,index,Company  Name,Details,Quick  Find,Option  Chain,Symbol
0,0,(A)  Agilent Tech. Corp.,Stock Research for A,Covered Calls for A,Option Chain for A,A
1,1,(AA)  ALCOA Inc.,Stock Research for AA,Covered Calls for AA,Option Chain for AA,AA
2,2,(AAIC)  Arlington Asset Investment Corp.,Stock Research for AAIC,Covered Calls for AAIC,Option Chain for AAIC,AAIC
3,3,(AAL)  American Airlines Group Inc.,Stock Research for AAL,Covered Calls for AAL,Option Chain for AAL,AAL
4,4,(AAN)  Aarons Inc.,Stock Research for AAN,Covered Calls for AAN,Option Chain for AAN,AAN
5,5,(AAOI)  Applied Optoelectronics Inc.,Stock Research for AAOI,Covered Calls for AAOI,Option Chain for AAOI,AAOI
6,6,(AAON)  AAON Inc.,Stock Research for AAON,Covered Calls for AAON,Option Chain for AAON,AAON
7,7,(AAP)  Advance Auto Parts Inc.,Stock Research for AAP,Covered Calls for AAP,Option Chain for AAP,AAP
8,8,(AAPL)  Apple Inc.,Stock Research for AAPL,Covered Calls for AAPL,Option Chain for AAPL,AAPL
9,9,(AAT)  American Assets Trust Inc.,Stock Research for AAT,Covered Calls for AAT,Option Chain for AAT,AAT
10,10,(AAU)  Almaden Minerals Ltd.,Stock Research for AAU,Covered Calls for AAU,Option Chain for AAU,AAU
11,11,(AAWW)  Atlas Air Worldwide Holdings Inc.,Stock Research for AAWW,Covered Calls for AAWW,Option Chain for AAWW,AAWW
12,12,(AAXJ)  iShares MSCI All Country Asia ex Japan Index ETF,Stock Research for AAXJ,Covered Calls for AAXJ,Option Chain for AAXJ,AAXJ
13,13,(AAXN)  Axon Enterprise,Stock Research for AAXN,Covered Calls for AAXN,Option Chain for AAXN,AAXN
14,14,(AB)  AllianceBernstein Holding LP,Stock Research for AB,Covered Calls for AB,Option Chain for AB,AB
15,15,(ABB)  ABB Ltd.,Stock Research for ABB,Covered Calls for ABB,Option Chain for ABB,ABB
16,16,(ABBV)  AbbVie Inc.,Stock Research for ABBV,Covered Calls for ABBV,Option Chain for ABBV,ABBV
17,17,(ABC)  AmerisourceBergen Corp.,Stock Research for ABC,Covered Calls for ABC,Option Chain for ABC,ABC
18,18,(ABCB)  Ameris Bancorp,Stock Research for ABCB,Covered Calls for ABCB,Option Chain for ABCB,ABCB
19,19,(ABEO)  Abeona Therapeutics Inc.,Stock Research for ABEO,Covered Calls for ABEO,Option Chain for ABEO,ABEO
20,20,(ABEV)  Ambev SA,Stock Research for ABEV,Covered Calls for ABEV,Option Chain for ABEV,ABEV
21,21,(ABG)  Asbury Automotive Group Inc,Stock Research for ABG,Covered Calls for ABG,Option Chain for ABG,ABG
22,22,(ABM)  ABM Industries Inc,Stock Research for ABM,Covered Calls for ABM,Option Chain for ABM,ABM
23,23,(ABMD)  ABIOMED Inc.,Stock Research for ABMD,Covered Calls for ABMD,Option Chain for ABMD,ABMD
24,24,(ABR)  Arbor Realty Trust Inc.,Stock Research for ABR,Covered Calls for ABR,Option Chain for ABR,ABR
25,25,(ABT)  Abbott Laboratories,Stock Research for ABT,Covered Calls for ABT,Option Chain for ABT,ABT
26,26,(ABTX)  Allegiance Bancshares Inc.,Stock Research for ABTX,Covered Calls for ABTX,Option Chain for ABTX,ABTX
27,27,(ABUS)  Arbutus Biopharma Corp.,Stock Research for ABUS,Covered Calls for ABUS,Option Chain for ABUS,ABUS
28,28,(ACA)  Arcosa Inc.,Stock Research for ACA,Covered Calls for ACA,Option Chain for ACA,ACA
29,29,(ACAD)  Acadia Pharm. Inc.,Stock Research for ACAD,Covered Calls for ACAD,Option Chain for ACAD,ACAD
30,30,(ACB)  Aurora Cannabis Inc.,Stock Research for ACB,Covered Calls for ACB,Option Chain for ACB,ACB
31,31,(ACC)  American Campus Comms. Inc.,Stock Research for ACC,Covered Calls for ACC,Option Chain for ACC,ACC
32,32,(ACCD)  Accolade Inc.,Stock Research for ACCD,Covered Calls for ACCD,Option Chain for ACCD,ACCD
33,33,(ACCO)  Acco Brands Corp.,Stock Research for ACCO,Covered Calls for ACCO,Option Chain for ACCO,ACCO
34,34,(ACEL)  Accel Entertainment Inc.,Stock Research for ACEL,Covered Calls for ACEL,Option Chain for ACEL,ACEL
35,35,(ACER)  Acer Therapeutics Inc.,Stock Research for ACER,Covered Calls for ACER,Option Chain for ACER,ACER
36,36,(ACES)  ALPS Clean Energy ETF,Stock Research for ACES,Covered Calls for ACES,Option Chain for ACES,ACES
37,37,(ACGL)  Arch Capital Group,Stock Research for ACGL,Covered Calls for ACGL,Option Chain for ACGL,ACGL
38,38,(ACH)  Aluminum Corp. of China Ltd.,Stock Research for ACH,Covered Calls for ACH,Option Chain for ACH,ACH
39,39,(ACHC)  Acadia Healthcare Company Inc.,Stock Research for ACHC,Covered Calls for ACHC,Option Chain for ACHC,ACHC
40,40,(ACI)  Albertsons Companies Inc.,Stock Research for ACI,Covered Calls for ACI,Option Chain for ACI,ACI
41,41,(ACIA)  Acacia Communications Inc.,Stock Research for ACIA,Covered Calls for ACIA,Option Chain for ACIA,ACIA
42,42,(ACIU)  AC Immune SA,Stock Research for ACIU,Covered Calls for ACIU,Option Chain for ACIU,ACIU
43,43,(ACIW)  ACI Worldwide Inc.,Stock Research for ACIW,Covered Calls for ACIW,Option Chain for ACIW,ACIW
44,44,(ACLS)  Axcelis Techs. Inc.,Stock Research for ACLS,Covered Calls for ACLS,Option Chain for ACLS,ACLS
45,45,(ACM)  AECOM,Stock Research for ACM,Covered Calls for ACM,Option Chain for ACM,ACM
46,46,(ACMR)  ACM Research Inc.,Stock Research for ACMR,Covered Calls for ACMR,Option Chain for ACMR,ACMR
47,47,(ACN)  Accenture plc,Stock Research for ACN,Covered Calls for ACN,Option Chain for ACN,ACN
48,48,(ACOR)  Acorda Therapeutics Inc.,Stock Research for ACOR,Covered Calls for ACOR,Option Chain for ACOR,ACOR
49,49,(ACRE)  Ares Commercial Real Estate Corp.,Stock Research for ACRE,Covered Calls for ACRE,Option Chain for ACRE,ACRE
50,50,(ACRS)  Aclaris Therapeutics Inc.,Stock Research for ACRS,Covered Calls for ACRS,Option Chain for ACRS,ACRS
51,51,(ACRX)  AcelRx Pharmaceuticals Inc.,Stock Research for ACRX,Covered Calls for ACRX,Option Chain for ACRX,ACRX
52,52,(ACTG)  Acacia Research Corp.,Stock Research for ACTG,Covered Calls for ACTG,Option Chain for ACTG,ACTG
53,53,(ACWI)  iShares MSCI ACWI Index ETF,Stock Research for ACWI,Covered Calls for ACWI,Option Chain for ACWI,ACWI
54,54,(ACWV)  iShares MSCI All Country World Min Volat Index ETF,Stock Research for ACWV,Covered Calls for ACWV,Option Chain for ACWV,ACWV
55,55,(ACWX)  iShares MSCI All Country World ex US Index ETF,Stock Research for ACWX,Covered Calls for ACWX,Option Chain for ACWX,ACWX
56,56,(ADAP)  Adaptimmune Therapeutics PLC,Stock Research for ADAP,Covered Calls for ADAP,Option Chain for ADAP,ADAP
57,57,(ADBE)  Adobe Systems Inc.,Stock Research for ADBE,Covered Calls for ADBE,Option Chain for ADBE,ADBE
58,58,(ADC)  Agree Realty Corp.,Stock Research for ADC,Covered Calls for ADC,Option Chain for ADC,ADC
59,59,(ADCT)  ADC Therapeutics SA,Stock Research for ADCT,Covered Calls for ADCT,Option Chain for ADCT,ADCT
60,60,(ADI)  Analog Devices Inc.,Stock Research for ADI,Covered Calls for ADI,Option Chain for ADI,ADI
61,61,(ADM)  Archer-Daniels-Midland Co.,Stock Research for ADM,Covered Calls for ADM,Option Chain for ADM,ADM
62,62,(ADMA)  ADMA Biologics Inc.,Stock Research for ADMA,Covered Calls for ADMA,Option Chain for ADMA,ADMA
63,63,(ADMP)  Adamis Pharmaceuticals Corp,Stock Research for ADMP,Covered Calls for ADMP,Option Chain for ADMP,ADMP
64,64,(ADMS)  Adamas Pharma. Inc.,Stock Research for ADMS,Covered Calls for ADMS,Option Chain for ADMS,ADMS
65,65,(ADNT)  Adient plc,Stock Research for ADNT,Covered Calls for ADNT,Option Chain for ADNT,ADNT
66,66,(ADP)  Automatic Data Processing Inc.,Stock Research for ADP,Covered Calls for ADP,Option Chain for ADP,ADP
67,67,(ADPT)  Adaptive Biotechnologies Corp.,Stock Research for ADPT,Covered Calls for ADPT,Option Chain for ADPT,ADPT
68,68,(ADS)  Alliance Data Systems Corp.,Stock Research for ADS,Covered Calls for ADS,Option Chain for ADS,ADS
69,69,(ADSK)  Autodesk Inc.,Stock Research for ADSK,Covered Calls for ADSK,Option Chain for ADSK,ADSK
70,70,(ADT)  ADT Inc.,Stock Research for ADT,Covered Calls for ADT,Option Chain for ADT,ADT
71,71,(ADTN)  ADTRAN Inc.,Stock Research for ADTN,Covered Calls for ADTN,Option Chain for ADTN,ADTN
72,72,(ADUS)  Addus HomeCare Corp.,Stock Research for ADUS,Covered Calls for ADUS,Option Chain for ADUS,ADUS
73,73,(ADV)  Advantage Solutions Inc.,Stock Research for ADV,Covered Calls for ADV,Option Chain for ADV,ADV
74,74,(ADVM)  Adverum Biotechnologies Inc.,Stock Research for ADVM,Covered Calls for ADVM,Option Chain for ADVM,ADVM
75,75,(AEE)  Ameren Corp.,Stock Research for AEE,Covered Calls for AEE,Option Chain for AEE,AEE
76,76,(AEG)  Aegon NV ADR,Stock Research for AEG,Covered Calls for AEG,Option Chain for AEG,AEG
77,77,(AEGN)  Insituform Technologies Inc.,Stock Research for AEGN,Covered Calls for AEGN,Option Chain for AEGN,AEGN
78,78,(AEIS)  Advanced Energy Industries,Stock Research for AEIS,Covered Calls for AEIS,Option Chain for AEIS,AEIS
79,79,(AEL)  American Equity Inv. Life Hldg. Co.,Stock Research for AEL,Covered Calls for AEL,Option Chain for AEL,AEL
80,80,(AEM)  Agnico-Eagle Mines Ltd.,Stock Research for AEM,Covered Calls for AEM,Option Chain for AEM,AEM
81,81,(AEO)  American Eagle Outfitters Inc.,Stock Research for AEO,Covered Calls for AEO,Option Chain for AEO,AEO
82,82,(AEP)  American Electric Power Co. Inc.,Stock Research for AEP,Covered Calls for AEP,Option Chain for AEP,AEP
83,83,(AER)  AerCap Holdings NV,Stock Research for AER,Covered Calls for AER,Option Chain for AER,AER
84,84,(AERI)  Aerie Pharmaceuticals Inc.,Stock Research for AERI,Covered Calls for AERI,Option Chain for AERI,AERI
85,85,(AES)  AES Corp. (The),Stock Research for AES,Covered Calls for AES,Option Chain for AES,AES
86,86,(AEZS)  Aeterna Zentaris Inc.,Stock Research for AEZS,Covered Calls for AEZS,Option Chain for AEZS,AEZS
87,87,(AFG)  American Financial Group Inc.,Stock Research for AFG,Covered Calls for AFG,Option Chain for AFG,AFG
88,88,(AFI)  Armstrong Flooring Inc.,Stock Research for AFI,Covered Calls for AFI,Option Chain for AFI,AFI
89,89,(AFL)  AFLAC Inc.,Stock Research for AFL,Covered Calls for AFL,Option Chain for AFL,AFL
90,90,(AFMD)  Affimed N.V.,Stock Research for AFMD,Covered Calls for AFMD,Option Chain for AFMD,AFMD
91,91,(AFTY)  Pacer CSOP FTSE China A50 ETF,Stock Research for AFTY,Covered Calls for AFTY,Option Chain for AFTY,AFTY
92,92,(AFYA)  Afya Ltd.,Stock Research for AFYA,Covered Calls for AFYA,Option Chain for AFYA,AFYA
93,93,(AG)  First Majestic Silver Corp.,Stock Research for AG,Covered Calls for AG,Option Chain for AG,AG
94,94,(AGCO)  AGCO Corp.,Stock Research for AGCO,Covered Calls for AGCO,Option Chain for AGCO,AGCO
95,95,(AGEN)  Agenus Inc.,Stock Research for AGEN,Covered Calls for AGEN,Option Chain for AGEN,AGEN
96,96,(AGFS)  AgroFresh Solutions Inc.,Stock Research for AGFS,Covered Calls for AGFS,Option Chain for AGFS,AGFS
97,97,(AGG)  iShares Lehman Aggregate Bond ETF,Stock Research for AGG,Covered Calls for AGG,Option Chain for AGG,AGG
98,98,(AGI)  Alamos Gold Inc.,Stock Research for AGI,Covered Calls for AGI,Option Chain for AGI,AGI
99,99,(AGIO)  Agios Pharmaceuticals Inc.,Stock Research for AGIO,Covered Calls for AGIO,Option Chain for AGIO,AGIO
100,100,(AGLE)  Aeglea BioTherapeutics Inc.,Stock Research for AGLE,Covered Calls for AGLE,Option Chain for AGLE,AGLE
101,101,(AGM)  Federal Agricultural Mortgage Corp.,Stock Research for AGM,Covered Calls for AGM,Option Chain for AGM,AGM
102,102,(AGNC)  AGNC Investment Corp.,Stock Research for AGNC,Covered Calls for AGNC,Option Chain for AGNC,AGNC
103,103,(AGO)  Assured Guaranty Ltd.,Stock Research for AGO,Covered Calls for AGO,Option Chain for AGO,AGO
104,104,(AGQ)  ProShares Ultra Silver ETF,Stock Research for AGQ,Covered Calls for AGQ,Option Chain for AGQ,AGQ
105,105,(AGR)  Avangrid Inc.,Stock Research for AGR,Covered Calls for AGR,Option Chain for AGR,AGR
106,106,(AGRO)  Adecoagro SA,Stock Research for AGRO,Covered Calls for AGRO,Option Chain for AGRO,AGRO
107,107,(AGRX)  Agile Therapeutics Inc.,Stock Research for AGRX,Covered Calls for AGRX,Option Chain for AGRX,AGRX
108,108,(AGS)  PlayAGS Inc.,Stock Research for AGS,Covered Calls for AGS,Option Chain for AGS,AGS
109,109,(AGTC)  Applied Genetic Technologies Corp,Stock Research for AGTC,Covered Calls for AGTC,Option Chain for AGTC,AGTC
110,110,(AGX)  Argan Inc.,Stock Research for AGX,Covered Calls for AGX,Option Chain for AGX,AGX
111,111,(AGYS)  Agilysys Inc.,Stock Research for AGYS,Covered Calls for AGYS,Option Chain for AGYS,AGYS
112,112,(AHC)  A. H. Belo Corp,Stock Research for AHC,Covered Calls for AHC,Option Chain for AHC,AHC
113,113,(AHH)  Armada Hoffler Properties Inc.,Stock Research for AHH,Covered Calls for AHH,Option Chain for AHH,AHH
114,114,(AHT)  Ashford Hospitality Trust Inc.,Stock Research for AHT,Covered Calls for AHT,Option Chain for AHT,AHT
115,115,(AIA)  iShares Asia 50 ETF,Stock Research for AIA,Covered Calls for AIA,Option Chain for AIA,AIA
116,116,(AIG)  American Intl. Group Inc.,Stock Research for AIG,Covered Calls for AIG,Option Chain for AIG,AIG
117,117,(AIMC)  Altra Industrial Motion Corp.,Stock Research for AIMC,Covered Calls for AIMC,Option Chain for AIMC,AIMC
118,118,(AIN)  Albany International Corp.,Stock Research for AIN,Covered Calls for AIN,Option Chain for AIN,AIN
119,119,(AINV)  Apollo Investment Corp.,Stock Research for AINV,Covered Calls for AINV,Option Chain for AINV,AINV
120,120,(AIR)  AAR Corp.,Stock Research for AIR,Covered Calls for AIR,Option Chain for AIR,AIR
121,121,(AIRG)  Airgain Inc.,Stock Research for AIRG,Covered Calls for AIRG,Option Chain for AIRG,AIRG
122,122,(AIT)  Applied Industrial Techs. Inc.,Stock Research for AIT,Covered Calls for AIT,Option Chain for AIT,AIT
123,123,(AIV)  Apartment Inv.& Mang. Class A,Stock Research for AIV,Covered Calls for AIV,Option Chain for AIV,AIV
124,124,(AIZ)  Assurant Inc.,Stock Research for AIZ,Covered Calls for AIZ,Option Chain for AIZ,AIZ
125,125,(AJG)  Arthur J. Gallager & Co.,Stock Research for AJG,Covered Calls for AJG,Option Chain for AJG,AJG
126,126,(AJRD)  Aerojet Rocketdyne Holdings Inc.,Stock Research for AJRD,Covered Calls for AJRD,Option Chain for AJRD,AJRD
127,127,(AJX)  Great Ajax Corp.,Stock Research for AJX,Covered Calls for AJX,Option Chain for AJX,AJX
128,128,(AKAM)  Akamai Tech. Inc.,Stock Research for AKAM,Covered Calls for AKAM,Option Chain for AKAM,AKAM
129,129,(AKBA)  Akebia Therapeutics Inc.,Stock Research for AKBA,Covered Calls for AKBA,Option Chain for AKBA,AKBA
130,130,(AKR)  Acadia Realty Trust REIT,Stock Research for AKR,Covered Calls for AKR,Option Chain for AKR,AKR
131,131,(AKRO)  Akero Therapeutics Inc.,Stock Research for AKRO,Covered Calls for AKRO,Option Chain for AKRO,AKRO
132,132,(AKTS)  Akoustis Techs. Inc.,Stock Research for AKTS,Covered Calls for AKTS,Option Chain for AKTS,AKTS
133,133,(AL)  Air Lease Corp.,Stock Research for AL,Covered Calls for AL,Option Chain for AL,AL
134,134,(ALB)  Albemarle Corp.,Stock Research for ALB,Covered Calls for ALB,Option Chain for ALB,ALB
135,135,(ALBO)  Albireo Pharma Inc.,Stock Research for ALBO,Covered Calls for ALBO,Option Chain for ALBO,ALBO
136,136,(ALC)  Alcon Inc.,Stock Research for ALC,Covered Calls for ALC,Option Chain for ALC,ALC
137,137,(ALDX)  Aldeyra Therapeutics Inc.,Stock Research for ALDX,Covered Calls for ALDX,Option Chain for ALDX,ALDX
138,138,(ALE)  ALLETE Inc.,Stock Research for ALE,Covered Calls for ALE,Option Chain for ALE,ALE
139,139,(ALEC)  Alector Inc.,Stock Research for ALEC,Covered Calls for ALEC,Option Chain for ALEC,ALEC
140,140,(ALEX)  Alexander & Baldwin Inc.,Stock Research for ALEX,Covered Calls for ALEX,Option Chain for ALEX,ALEX
141,141,(ALFA)  AlphaClone Alternative Alpha ETF,Stock Research for ALFA,Covered Calls for ALFA,Option Chain for ALFA,ALFA
142,142,(ALG)  Alamo Group Inc.,Stock Research for ALG,Covered Calls for ALG,Option Chain for ALG,ALG
143,143,(ALGN)  Align Tech. Inc.,Stock Research for ALGN,Covered Calls for ALGN,Option Chain for ALGN,ALGN
144,144,(ALGT)  Allegiant Travel Company,Stock Research for ALGT,Covered Calls for ALGT,Option Chain for ALGT,ALGT
145,145,(ALK)  Alaska Air Group Inc.,Stock Research for ALK,Covered Calls for ALK,Option Chain for ALK,ALK
146,146,(ALKS)  Alkermes Inc.,Stock Research for ALKS,Covered Calls for ALKS,Option Chain for ALKS,ALKS
147,147,(ALL)  Allstate Corp. (The),Stock Research for ALL,Covered Calls for ALL,Option Chain for ALL,ALL
148,148,(ALLE)  Allegion PLC,Stock Research for ALLE,Covered Calls for ALLE,Option Chain for ALLE,ALLE
149,149,(ALLK)  Allakos Inc.,Stock Research for ALLK,Covered Calls for ALLK,Option Chain for ALLK,ALLK
150,150,(ALLO)  Allogene Therapeutics Inc.,Stock Research for ALLO,Covered Calls for ALLO,Option Chain for ALLO,ALLO
151,151,(ALLT)  Allot Communications Ltd.,Stock Research for ALLT,Covered Calls for ALLT,Option Chain for ALLT,ALLT
152,152,(ALLY)  Ally Financial Inc.,Stock Research for ALLY,Covered Calls for ALLY,Option Chain for ALLY,ALLY
153,153,(ALNY)  Alnylam Pharma. Inc.,Stock Research for ALNY,Covered Calls for ALNY,Option Chain for ALNY,ALNY
154,154,(ALRM)  Alarm.com Holdings Inc.,Stock Research for ALRM,Covered Calls for ALRM,Option Chain for ALRM,ALRM
155,155,(ALSK)  Alaska Comms. Sys. Grp. Inc.,Stock Research for ALSK,Covered Calls for ALSK,Option Chain for ALSK,ALSK
156,156,(ALSN)  Allison Transmission Holdings Inc.,Stock Research for ALSN,Covered Calls for ALSN,Option Chain for ALSN,ALSN
157,157,(ALT)  Altimmune Inc.,Stock Research for ALT,Covered Calls for ALT,Option Chain for ALT,ALT
158,158,(ALTG)  Alta Equipment Group Inc.,Stock Research for ALTG,Covered Calls for ALTG,Option Chain for ALTG,ALTG
159,159,(ALTR)  Altair Engineering Inc,Stock Research for ALTR,Covered Calls for ALTR,Option Chain for ALTR,ALTR
160,160,(ALV)  Autoliv Inc.,Stock Research for ALV,Covered Calls for ALV,Option Chain for ALV,ALV
161,161,(ALVR)  AlloVir Inc.,Stock Research for ALVR,Covered Calls for ALVR,Option Chain for ALVR,ALVR
162,162,(ALXN)  Alexion Pharma. Inc.,Stock Research for ALXN,Covered Calls for ALXN,Option Chain for ALXN,ALXN
163,163,(AM)  Antero Midstream Partners LP,Stock Research for AM,Covered Calls for AM,Option Chain for AM,AM
164,164,(AMAG)  Advanced Magnetics Inc.,Stock Research for AMAG,Covered Calls for AMAG,Option Chain for AMAG,AMAG
165,165,(AMAT)  Applied Mats. Inc.,Stock Research for AMAT,Covered Calls for AMAT,Option Chain for AMAT,AMAT
166,166,(AMBA)  Ambarella Inc.,Stock Research for AMBA,Covered Calls for AMBA,Option Chain for AMBA,AMBA
167,167,(AMBC)  Ambac Financial Group Inc.,Stock Research for AMBC,Covered Calls for AMBC,Option Chain for AMBC,AMBC
168,168,(AMC)  AMC Entertainment Holdings Inc.,Stock Research for AMC,Covered Calls for AMC,Option Chain for AMC,AMC
169,169,(AMCR)  Amcor plc,Stock Research for AMCR,Covered Calls for AMCR,Option Chain for AMCR,AMCR
170,170,(AMCX)  AMC Networks Inc.,Stock Research for AMCX,Covered Calls for AMCX,Option Chain for AMCX,AMCX
171,171,(AMD)  Advanced Micro Devices Inc.,Stock Research for AMD,Covered Calls for AMD,Option Chain for AMD,AMD
172,172,(AME)  Ametek Inc.,Stock Research for AME,Covered Calls for AME,Option Chain for AME,AME
173,173,(AMED)  Amedisys Inc.,Stock Research for AMED,Covered Calls for AMED,Option Chain for AMED,AMED
174,174,(AMG)  Affiliated Mgrs. Gp.,Stock Research for AMG,Covered Calls for AMG,Option Chain for AMG,AMG
175,175,(AMGN)  Amgen Inc.,Stock Research for AMGN,Covered Calls for AMGN,Option Chain for AMGN,AMGN
176,176,(AMH)  American Homes 4 Rent,Stock Research for AMH,Covered Calls for AMH,Option Chain for AMH,AMH
177,177,(AMJ)  JPMorgan Alerian MLP Index ETN,Stock Research for AMJ,Covered Calls for AMJ,Option Chain for AMJ,AMJ
178,178,(AMKR)  Amkor Tech. Inc.,Stock Research for AMKR,Covered Calls for AMKR,Option Chain for AMKR,AMKR
179,179,(AMLP)  Alerian MLP ETF,Stock Research for AMLP,Covered Calls for AMLP,Option Chain for AMLP,AMLP
180,180,(AMN)  AMN Healthcare Services Inc.,Stock Research for AMN,Covered Calls for AMN,Option Chain for AMN,AMN
181,181,(AMNB)  American National Bankshares Inc.,Stock Research for AMNB,Covered Calls for AMNB,Option Chain for AMNB,AMNB
182,182,(AMOT)  Allied Motion Technologies Inc.,Stock Research for AMOT,Covered Calls for AMOT,Option Chain for AMOT,AMOT
183,183,(AMP)  Ameriprise Financial Inc.,Stock Research for AMP,Covered Calls for AMP,Option Chain for AMP,AMP
184,184,(AMPE)  Ampio Pharmaceuticals Inc.,Stock Research for AMPE,Covered Calls for AMPE,Option Chain for AMPE,AMPE
185,185,(AMPH)  Amphastar Pharmaceuticals Inc.,Stock Research for AMPH,Covered Calls for AMPH,Option Chain for AMPH,AMPH
186,186,(AMPY)  Amplify Energy Corp.,Stock Research for AMPY,Covered Calls for AMPY,Option Chain for AMPY,AMPY
187,187,(AMRC)  Ameresco Inc.,Stock Research for AMRC,Covered Calls for AMRC,Option Chain for AMRC,AMRC
188,188,(AMRN)  Amarin Corp. plc,Stock Research for AMRN,Covered Calls for AMRN,Option Chain for AMRN,AMRN
189,189,(AMRS)  Amyris Inc.,Stock Research for AMRS,Covered Calls for AMRS,Option Chain for AMRS,AMRS
190,190,(AMRX)  Amneal Pharmaceuticals Inc.,Stock Research for AMRX,Covered Calls for AMRX,Option Chain for AMRX,AMRX
191,191,(AMSC)  American Superconductor Corp.,Stock Research for AMSC,Covered Calls for AMSC,Option Chain for AMSC,AMSC
192,192,(AMSF)  Amerisafe Inc.,Stock Research for AMSF,Covered Calls for AMSF,Option Chain for AMSF,AMSF
193,193,(AMSWA)  American Software Inc.,Stock Research for AMSWA,Covered Calls for AMSWA,Option Chain for AMSWA,AMSWA
194,194,(AMT)  American Tower Corp.,Stock Research for AMT,Covered Calls for AMT,Option Chain for AMT,AMT
195,195,(AMTX)  Aemetis Inc.,Stock Research for AMTX,Covered Calls for AMTX,Option Chain for AMTX,AMTX
196,196,(AMWD)  American Woodmark Corp.,Stock Research for AMWD,Covered Calls for AMWD,Option Chain for AMWD,AMWD
197,197,(AMWL)  American Well Corp,Stock Research for AMWL,Covered Calls for AMWL,Option Chain for AMWL,AMWL
198,198,(AMX)  America Movil S.A. de C.V.,Stock Research for AMX,Covered Calls for AMX,Option Chain for AMX,AMX
199,199,(AMZA)  InfraCap MLP ETF,Stock Research for AMZA,Covered Calls for AMZA,Option Chain for AMZA,AMZA
200,200,(AMZN)  Amazon.com Inc.,Stock Research for AMZN,Covered Calls for AMZN,Option Chain for AMZN,AMZN
201,201,(AN)  AutoNation Inc.,Stock Research for AN,Covered Calls for AN,Option Chain for AN,AN
202,202,(ANAB)  AnaptysBio Inc.,Stock Research for ANAB,Covered Calls for ANAB,Option Chain for ANAB,ANAB
203,203,(ANAT)  American National Insurance Co.,Stock Research for ANAT,Covered Calls for ANAT,Option Chain for ANAT,ANAT
204,204,(ANDE)  Andersons Inc. (The),Stock Research for ANDE,Covered Calls for ANDE,Option Chain for ANDE,ANDE
205,205,(ANET)  Arista Networks Inc.,Stock Research for ANET,Covered Calls for ANET,Option Chain for ANET,ANET
206,206,(ANF)  Abercrombie & Fitch Co.,Stock Research for ANF,Covered Calls for ANF,Option Chain for ANF,ANF
207,207,(ANGI)  Angie`s List Inc.,Stock Research for ANGI,Covered Calls for ANGI,Option Chain for ANGI,ANGI
208,208,(ANGL)  VanEck Vectors Fallen Angel HiYld Bd ETF,Stock Research for ANGL,Covered Calls for ANGL,Option Chain for ANGL,ANGL
209,209,(ANGO)  AngioDynamics Inc.,Stock Research for ANGO,Covered Calls for ANGO,Option Chain for ANGO,ANGO
210,210,(ANH)  Anworth Mortgage Asset Corp.,Stock Research for ANH,Covered Calls for ANH,Option Chain for ANH,ANH
211,211,(ANIK)  Anika Therapeutics Inc.,Stock Research for ANIK,Covered Calls for ANIK,Option Chain for ANIK,ANIK
212,212,(ANIP)  ANI Pharmaceuticals Inc.,Stock Research for ANIP,Covered Calls for ANIP,Option Chain for ANIP,ANIP
213,213,(ANSS)  ANSYS Inc.,Stock Research for ANSS,Covered Calls for ANSS,Option Chain for ANSS,ANSS
214,214,(ANTE)  AirNet Technology Inc.,Stock Research for ANTE,Covered Calls for ANTE,Option Chain for ANTE,ANTE
215,215,(ANTM)  Anthem Inc.,Stock Research for ANTM,Covered Calls for ANTM,Option Chain for ANTM,ANTM
216,216,(AON)  AON Corp.,Stock Research for AON,Covered Calls for AON,Option Chain for AON,AON
217,217,(AOS)  AO Smith Corp.,Stock Research for AOS,Covered Calls for AOS,Option Chain for AOS,AOS
218,218,(AOSL)  Alpha & Omega Semiconductor Ltd.,Stock Research for AOSL,Covered Calls for AOSL,Option Chain for AOSL,AOSL
219,219,(AOUT)  American Outdoor Brands Inc.,Stock Research for AOUT,Covered Calls for AOUT,Option Chain for AOUT,AOUT
220,220,(AP)  Ampco-Pittsburgh Corp.,Stock Research for AP,Covered Calls for AP,Option Chain for AP,AP
221,221,(APA)  Apache Corp.,Stock Research for APA,Covered Calls for APA,Option Chain for APA,APA
222,222,(APAM)  Artisan Partners Asset Management Inc.,Stock Research for APAM,Covered Calls for APAM,Option Chain for APAM,APAM
223,223,(APD)  Air Products & Chemicals Inc.,Stock Research for APD,Covered Calls for APD,Option Chain for APD,APD
224,224,(APEI)  American Public Education Inc.,Stock Research for APEI,Covered Calls for APEI,Option Chain for APEI,APEI
225,225,(APEX)  Apex Global Brands Inc.,Stock Research for APEX,Covered Calls for APEX,Option Chain for APEX,APEX
226,226,(APG)  APi Group Corp.,Stock Research for APG,Covered Calls for APG,Option Chain for APG,APG
227,227,(APH)  Amphenol Corp.,Stock Research for APH,Covered Calls for APH,Option Chain for APH,APH
228,228,(APHA)  Aphria Inc.,Stock Research for APHA,Covered Calls for APHA,Option Chain for APHA,APHA
229,229,(API)  Agora Inc.,Stock Research for API,Covered Calls for API,Option Chain for API,API
230,230,(APLE)  Apple Hospitality REIT,Stock Research for APLE,Covered Calls for APLE,Option Chain for APLE,APLE
231,231,(APLS)  Apellis Pharmaceuticals Inc.,Stock Research for APLS,Covered Calls for APLS,Option Chain for APLS,APLS
232,232,(APLT)  Applied Therapeutics Inc.,Stock Research for APLT,Covered Calls for APLT,Option Chain for APLT,APLT
233,233,(APO)  Apollo Global Management LLC,Stock Research for APO,Covered Calls for APO,Option Chain for APO,APO
234,234,(APOG)  Apogee Enterprises Inc.,Stock Research for APOG,Covered Calls for APOG,Option Chain for APOG,APOG
235,235,(APPF)  AppFolio Inc.,Stock Research for APPF,Covered Calls for APPF,Option Chain for APPF,APPF
236,236,(APPN)  Appian Corp.,Stock Research for APPN,Covered Calls for APPN,Option Chain for APPN,APPN
237,237,(APPS)  Digital Turbine Inc.,Stock Research for APPS,Covered Calls for APPS,Option Chain for APPS,APPS
