,index,Company  Name,Details,Quick  Find,Option  Chain,Symbol
3713,36,(TDOC)  Teladoc Inc.,Stock Research for TDOC,Covered Calls for TDOC,Option Chain for TDOC,TDOC
3714,37,(TDS)  Telephone & Data Systems Inc.,Stock Research for TDS,Covered Calls for TDS,Option Chain for TDS,TDS
3715,38,(TDW)  Tidewater Inc.,Stock Research for TDW,Covered Calls for TDW,Option Chain for TDW,TDW
3716,39,(TDY)  Teledyne Tech. Inc.,Stock Research for TDY,Covered Calls for TDY,Option Chain for TDY,TDY
3717,40,(TEAM)  Atlassian Corp. PLC,Stock Research for TEAM,Covered Calls for TEAM,Option Chain for TEAM,TEAM
3718,41,(TECH)  Techne Corp.,Stock Research for TECH,Covered Calls for TECH,Option Chain for TECH,TECH
3719,42,(TECK)  Teck Resources Ltd.,Stock Research for TECK,Covered Calls for TECK,Option Chain for TECK,TECK
3720,43,(TECL)  Direxion Daily Technology Bull 3X ETF,Stock Research for TECL,Covered Calls for TECL,Option Chain for TECL,TECL
3721,44,(TECS)  Direxion Daily Technology Bear 3X ETF,Stock Research for TECS,Covered Calls for TECS,Option Chain for TECS,TECS
3722,45,(TEF)  Telefonica de Espana S.A. ADR,Stock Research for TEF,Covered Calls for TEF,Option Chain for TEF,TEF
3723,46,(TEL)  TE Connectivity Ltd.,Stock Research for TEL,Covered Calls for TEL,Option Chain for TEL,TEL
3724,47,(TELL)  Tellurian Inc.,Stock Research for TELL,Covered Calls for TELL,Option Chain for TELL,TELL
3725,48,(TEN)  Tenneco Inc.,Stock Research for TEN,Covered Calls for TEN,Option Chain for TEN,TEN
3726,49,(TENB)  Tenable Holdings Inc.,Stock Research for TENB,Covered Calls for TENB,Option Chain for TENB,TENB
3727,50,(TEO)  Telecom Argentina SA ADR,Stock Research for TEO,Covered Calls for TEO,Option Chain for TEO,TEO
3728,51,(TER)  Teradyne Inc.,Stock Research for TER,Covered Calls for TER,Option Chain for TER,TER
3729,52,(TEUM)  Pareteum Corp,Stock Research for TEUM,Covered Calls for TEUM,Option Chain for TEUM,TEUM
3730,53,(TEVA)  Teva Pharma. Indus. Ltd.,Stock Research for TEVA,Covered Calls for TEVA,Option Chain for TEVA,TEVA
3731,54,(TEX)  Terex Corp.,Stock Research for TEX,Covered Calls for TEX,Option Chain for TEX,TEX
3732,55,(TFC)  Truist Financial Corp.,Stock Research for TFC,Covered Calls for TFC,Option Chain for TFC,TFC
3733,56,(TFFP)  TFF Pharmaceuticals Inc.,Stock Research for TFFP,Covered Calls for TFFP,Option Chain for TFFP,TFFP
3734,57,(TFI)  SPDR Lehman Municipal Bond ETF,Stock Research for TFI,Covered Calls for TFI,Option Chain for TFI,TFI
3735,58,(TFLO)  iShares Treasury Floating Rate Bond ETF,Stock Research for TFLO,Covered Calls for TFLO,Option Chain for TFLO,TFLO
3736,59,(TFSL)  TFS Financial Corp.,Stock Research for TFSL,Covered Calls for TFSL,Option Chain for TFSL,TFSL
3737,60,(TFX)  Teleflex Inc.,Stock Research for TFX,Covered Calls for TFX,Option Chain for TFX,TFX
3738,61,(TG)  Tredegar Corp.,Stock Research for TG,Covered Calls for TG,Option Chain for TG,TG
3739,62,(TGB)  Taseko Mines Ltd.,Stock Research for TGB,Covered Calls for TGB,Option Chain for TGB,TGB
3740,63,(TGH)  Textainer Group Holdings Limited,Stock Research for TGH,Covered Calls for TGH,Option Chain for TGH,TGH
3741,64,(TGI)  Triumph Group Inc.,Stock Research for TGI,Covered Calls for TGI,Option Chain for TGI,TGI
3742,65,(TGNA)  TEGNA Inc.,Stock Research for TGNA,Covered Calls for TGNA,Option Chain for TGNA,TGNA
3743,66,(TGP)  Teekay LNG Partners LP,Stock Research for TGP,Covered Calls for TGP,Option Chain for TGP,TGP
3744,67,(TGS)  Transportadora de Gas Del Sur SA,Stock Research for TGS,Covered Calls for TGS,Option Chain for TGS,TGS
3745,68,(TGT)  Target Corp.,Stock Research for TGT,Covered Calls for TGT,Option Chain for TGT,TGT
3746,69,(TGTX)  TG Therapeutics Inc.,Stock Research for TGTX,Covered Calls for TGTX,Option Chain for TGTX,TGTX
3747,70,(THC)  Tenet Healthcare Corp.,Stock Research for THC,Covered Calls for THC,Option Chain for THC,THC
3748,71,(THCX)  The Cannabis ETF,Stock Research for THCX,Covered Calls for THCX,Option Chain for THCX,THCX
3749,72,(THD)  iShares MSCI Thailand Capped ETF,Stock Research for THD,Covered Calls for THD,Option Chain for THD,THD
3750,73,(THFF)  First Financial Corp.,Stock Research for THFF,Covered Calls for THFF,Option Chain for THFF,THFF
3751,74,(THG)  Hanover Insurance Group Inc.,Stock Research for THG,Covered Calls for THG,Option Chain for THG,THG
3752,75,(THO)  Thor Indus. Inc.,Stock Research for THO,Covered Calls for THO,Option Chain for THO,THO
3753,76,(THR)  Thermon Group Holdings Inc.,Stock Research for THR,Covered Calls for THR,Option Chain for THR,THR
3754,77,(THRM)  GenTherm Inc.,Stock Research for THRM,Covered Calls for THRM,Option Chain for THRM,THRM
3755,78,(THS)  TreeHouse Foods Inc.,Stock Research for THS,Covered Calls for THS,Option Chain for THS,THS
3756,79,(TIF)  Tiffany & Co.,Stock Research for TIF,Covered Calls for TIF,Option Chain for TIF,TIF
3757,80,(TIGR)  UP Fintech Holding Ltd,Stock Research for TIGR,Covered Calls for TIGR,Option Chain for TIGR,TIGR
3758,81,(TILE)  Interface Inc.,Stock Research for TILE,Covered Calls for TILE,Option Chain for TILE,TILE
3759,82,(TIP)  iShares Barclays TIPS Bond ETF,Stock Research for TIP,Covered Calls for TIP,Option Chain for TIP,TIP
3760,83,(TISI)  Team Inc.,Stock Research for TISI,Covered Calls for TISI,Option Chain for TISI,TISI
3761,84,(TITN)  Titan Machinery Inc.,Stock Research for TITN,Covered Calls for TITN,Option Chain for TITN,TITN
3762,85,(TJX)  TJX Companies Inc. (The),Stock Research for TJX,Covered Calls for TJX,Option Chain for TJX,TJX
3763,86,(TK)  Teekay Corp.,Stock Research for TK,Covered Calls for TK,Option Chain for TK,TK
3764,87,(TKC)  Turkcell Iletisim Hizmetleri AS,Stock Research for TKC,Covered Calls for TKC,Option Chain for TKC,TKC
3765,88,(TKR)  Timken Co. (The),Stock Research for TKR,Covered Calls for TKR,Option Chain for TKR,TKR
3766,89,(TLGT)  Teligent Inc.,Stock Research for TLGT,Covered Calls for TLGT,Option Chain for TLGT,TLGT
3767,90,(TLH)  iShares Barclays 10-20 Year Treas. Bond Index ETF,Stock Research for TLH,Covered Calls for TLH,Option Chain for TLH,TLH
3768,91,(TLMD)  Telemed Inc.,Stock Research for TLMD,Covered Calls for TLMD,Option Chain for TLMD,TLMD
3769,92,(TLND)  Talend SA,Stock Research for TLND,Covered Calls for TLND,Option Chain for TLND,TLND
3770,93,(TLRDQ)  Tailored Brands Inc.,Stock Research for TLRDQ,Covered Calls for TLRDQ,Option Chain for TLRDQ,TLRDQ
3771,94,(TLRY)  Tilray Inc.,Stock Research for TLRY,Covered Calls for TLRY,Option Chain for TLRY,TLRY
3772,95,(TLSA)  Tiziana Life Sciences plc,Stock Research for TLSA,Covered Calls for TLSA,Option Chain for TLSA,TLSA
3773,96,(TLT)  iShares 20+ Year Treasury Bond ETF,Stock Research for TLT,Covered Calls for TLT,Option Chain for TLT,TLT
3774,97,(TLYS)  Tilly`s Inc.,Stock Research for TLYS,Covered Calls for TLYS,Option Chain for TLYS,TLYS
3775,98,(TM)  Toyota Motor Corp.,Stock Research for TM,Covered Calls for TM,Option Chain for TM,TM
3776,99,(TMDX)  TransMedics Group Inc.,Stock Research for TMDX,Covered Calls for TMDX,Option Chain for TMDX,TMDX
3777,100,(TME)  Tencent Music Entertainment Group,Stock Research for TME,Covered Calls for TME,Option Chain for TME,TME
3778,101,(TMF)  Direxion Daily 30 Yr Trsy BULL 3X Shares ETF,Stock Research for TMF,Covered Calls for TMF,Option Chain for TMF,TMF
3779,102,(TMHC)  Taylor Morrison Home Corp.,Stock Research for TMHC,Covered Calls for TMHC,Option Chain for TMHC,TMHC
3780,103,(TMO)  Thermo Fisher Scientific Inc.,Stock Research for TMO,Covered Calls for TMO,Option Chain for TMO,TMO
3781,104,(TMP)  Tompkins Financial Corp.,Stock Research for TMP,Covered Calls for TMP,Option Chain for TMP,TMP
3782,105,(TMQ)  Trilogy Metals Inc.,Stock Research for TMQ,Covered Calls for TMQ,Option Chain for TMQ,TMQ
3783,106,(TMST)  Timken Steel Corp.,Stock Research for TMST,Covered Calls for TMST,Option Chain for TMST,TMST
3784,107,(TMUS)  T-Mobile US Inc.,Stock Research for TMUS,Covered Calls for TMUS,Option Chain for TMUS,TMUS
3785,108,(TMV)  Direxion Daily 30 Yr Trsy BEAR 3X Shares ETF,Stock Research for TMV,Covered Calls for TMV,Option Chain for TMV,TMV
3786,109,(TMX)  Terminix Global Holdings,Stock Research for TMX,Covered Calls for TMX,Option Chain for TMX,TMX
3787,110,(TNA)  Direxion Daily Small Cap Bull 3X ETF,Stock Research for TNA,Covered Calls for TNA,Option Chain for TNA,TNA
3788,111,(TNAV)  TeleNav Inc.,Stock Research for TNAV,Covered Calls for TNAV,Option Chain for TNAV,TNAV
3789,112,(TNC)  Tennant Co.,Stock Research for TNC,Covered Calls for TNC,Option Chain for TNC,TNC
3790,113,(TNDM)  Tandem Diabetes Care Inc.,Stock Research for TNDM,Covered Calls for TNDM,Option Chain for TNDM,TNDM
3791,114,(TNET)  TriNet Group Inc.,Stock Research for TNET,Covered Calls for TNET,Option Chain for TNET,TNET
3792,115,(TNK)  Teekay Tankers Ltd.,Stock Research for TNK,Covered Calls for TNK,Option Chain for TNK,TNK
3793,116,(TNP)  Tsakos Energy Navigation Ltd. ASA,Stock Research for TNP,Covered Calls for TNP,Option Chain for TNP,TNP
3794,117,(TOL)  Toll Brothers Inc.,Stock Research for TOL,Covered Calls for TOL,Option Chain for TOL,TOL
3795,118,(TOT)  Total SA ADR,Stock Research for TOT,Covered Calls for TOT,Option Chain for TOT,TOT
3796,119,(TOUR)  Tuniu Corp,Stock Research for TOUR,Covered Calls for TOUR,Option Chain for TOUR,TOUR
3797,120,(TOWN)  TowneBank,Stock Research for TOWN,Covered Calls for TOWN,Option Chain for TOWN,TOWN
3798,121,(TPB)  Turning Point Brands Inc.,Stock Research for TPB,Covered Calls for TPB,Option Chain for TPB,TPB
3799,122,(TPC)  Tutor Perini Corp.,Stock Research for TPC,Covered Calls for TPC,Option Chain for TPC,TPC
3800,123,(TPCO)  Tribune Publishing Co.,Stock Research for TPCO,Covered Calls for TPCO,Option Chain for TPCO,TPCO
3801,124,(TPH)  TRI Pointe Group Inc.,Stock Research for TPH,Covered Calls for TPH,Option Chain for TPH,TPH
3802,125,(TPIC)  TPI Composites Inc.,Stock Research for TPIC,Covered Calls for TPIC,Option Chain for TPIC,TPIC
3803,126,(TPR)  Tapestry Inc.,Stock Research for TPR,Covered Calls for TPR,Option Chain for TPR,TPR
3804,127,(TPRE)  Third Point Reinsurance Ltd.,Stock Research for TPRE,Covered Calls for TPRE,Option Chain for TPRE,TPRE
3805,128,(TPTX)  Turning Point Therapeutics Inc.,Stock Research for TPTX,Covered Calls for TPTX,Option Chain for TPTX,TPTX
3806,129,(TPVG)  TriplePoint Venture Growth BDC Corp.,Stock Research for TPVG,Covered Calls for TPVG,Option Chain for TPVG,TPVG
3807,130,(TPX)  Tempur Sealy International Inc.,Stock Research for TPX,Covered Calls for TPX,Option Chain for TPX,TPX
3808,131,(TQQQ)  ProShares Ultra Pro QQQ ETF,Stock Research for TQQQ,Covered Calls for TQQQ,Option Chain for TQQQ,TQQQ
3809,132,(TR)  Tootsie Roll Industries Inc.,Stock Research for TR,Covered Calls for TR,Option Chain for TR,TR
3810,133,(TRC)  Tejon Ranch Co.,Stock Research for TRC,Covered Calls for TRC,Option Chain for TRC,TRC
3811,134,(TREC)  Trecora Resources,Stock Research for TREC,Covered Calls for TREC,Option Chain for TREC,TREC
3812,135,(TREE)  LendingTree Inc.,Stock Research for TREE,Covered Calls for TREE,Option Chain for TREE,TREE
3813,136,(TREX)  Trex Co. Inc.,Stock Research for TREX,Covered Calls for TREX,Option Chain for TREX,TREX
3814,137,(TRGP)  Targa Resources Corp.,Stock Research for TRGP,Covered Calls for TRGP,Option Chain for TRGP,TRGP
3815,138,(TRHC)  Tabula Rasa Healthcare Inc.,Stock Research for TRHC,Covered Calls for TRHC,Option Chain for TRHC,TRHC
3816,139,(TRI)  Thomson Reuters Corp.,Stock Research for TRI,Covered Calls for TRI,Option Chain for TRI,TRI
3817,140,(TRIB)  Trinity Biotech PLC,Stock Research for TRIB,Covered Calls for TRIB,Option Chain for TRIB,TRIB
3818,141,(TRIL)  Trillium Therapeutics Inc.,Stock Research for TRIL,Covered Calls for TRIL,Option Chain for TRIL,TRIL
3819,142,(TRIP)  TripAdvisor Inc.,Stock Research for TRIP,Covered Calls for TRIP,Option Chain for TRIP,TRIP
3820,143,(TRMB)  Trimble Navigation Ltd.,Stock Research for TRMB,Covered Calls for TRMB,Option Chain for TRMB,TRMB
3821,144,(TRMK)  Trustmark Corp.,Stock Research for TRMK,Covered Calls for TRMK,Option Chain for TRMK,TRMK
3822,145,(TRN)  Trinity Industries Inc.,Stock Research for TRN,Covered Calls for TRN,Option Chain for TRN,TRN
3823,146,(TRNE)  Trine Acquisition Corp.,Stock Research for TRNE,Covered Calls for TRNE,Option Chain for TRNE,TRNE
3824,147,(TRNO)  Terreno Realty Corp.,Stock Research for TRNO,Covered Calls for TRNO,Option Chain for TRNO,TRNO
3825,148,(TROW)  T. Rowe Price Group Inc.,Stock Research for TROW,Covered Calls for TROW,Option Chain for TROW,TROW
3826,149,(TROX)  Tronox Inc.,Stock Research for TROX,Covered Calls for TROX,Option Chain for TROX,TROX
3827,150,(TRP)  TransCanada Corp.,Stock Research for TRP,Covered Calls for TRP,Option Chain for TRP,TRP
3828,151,(TRQ)  Turquoise Hill Resources Ltd.,Stock Research for TRQ,Covered Calls for TRQ,Option Chain for TRQ,TRQ
3829,152,(TRS)  TriMas Corp.,Stock Research for TRS,Covered Calls for TRS,Option Chain for TRS,TRS
3830,153,(TRST)  TrustCo Bank Corp. NY,Stock Research for TRST,Covered Calls for TRST,Option Chain for TRST,TRST
3831,154,(TRTN)  Triton International Ltd.,Stock Research for TRTN,Covered Calls for TRTN,Option Chain for TRTN,TRTN
3832,155,(TRTX)  TPG RE Finance Trust Inc.,Stock Research for TRTX,Covered Calls for TRTX,Option Chain for TRTX,TRTX
3833,156,(TRU)  TransUnion,Stock Research for TRU,Covered Calls for TRU,Option Chain for TRU,TRU
3834,157,(TRUE)  TrueCar Inc.,Stock Research for TRUE,Covered Calls for TRUE,Option Chain for TRUE,TRUE
3835,158,(TRUP)  Trupanion Inc.,Stock Research for TRUP,Covered Calls for TRUP,Option Chain for TRUP,TRUP
3836,159,(TRV)  Travelers Companies Inc. (The),Stock Research for TRV,Covered Calls for TRV,Option Chain for TRV,TRV
3837,160,(TRVG)  trivago N.V.,Stock Research for TRVG,Covered Calls for TRVG,Option Chain for TRVG,TRVG
3838,161,(TRVN)  Trevena Inc.,Stock Research for TRVN,Covered Calls for TRVN,Option Chain for TRVN,TRVN
3839,162,(TRWH)  Twin River Worldwide Holdings Inc.,Stock Research for TRWH,Covered Calls for TRWH,Option Chain for TRWH,TRWH
3840,163,(TRX)  Tanzanian Royalty Exploration Corp.,Stock Research for TRX,Covered Calls for TRX,Option Chain for TRX,TRX
3841,164,(TRXC)  TransEnterix Inc.,Stock Research for TRXC,Covered Calls for TRXC,Option Chain for TRXC,TRXC
3842,165,(TS)  Tenaris SA,Stock Research for TS,Covered Calls for TS,Option Chain for TS,TS
3843,166,(TSCO)  Tractor Supply Co.,Stock Research for TSCO,Covered Calls for TSCO,Option Chain for TSCO,TSCO
3844,167,(TSE)  Trinseo SA,Stock Research for TSE,Covered Calls for TSE,Option Chain for TSE,TSE
3845,168,(TSEM)  Tower Semiconductor Ltd.,Stock Research for TSEM,Covered Calls for TSEM,Option Chain for TSEM,TSEM
3846,169,(TSLA)  Tesla Motors Inc.,Stock Research for TSLA,Covered Calls for TSLA,Option Chain for TSLA,TSLA
3847,170,(TSLX)  TPG Specialty Lending Inc.,Stock Research for TSLX,Covered Calls for TSLX,Option Chain for TSLX,TSLX
3848,171,(TSM)  Taiwan Semicon. Manuf. Co. Ltd.,Stock Research for TSM,Covered Calls for TSM,Option Chain for TSM,TSM
3849,172,(TSN)  Tyson Foods Inc. Class A,Stock Research for TSN,Covered Calls for TSN,Option Chain for TSN,TSN
3850,173,(TSQ)  Townsquare Media Inc.,Stock Research for TSQ,Covered Calls for TSQ,Option Chain for TSQ,TSQ
3851,174,(TT)  Trane Technologies PLC,Stock Research for TT,Covered Calls for TT,Option Chain for TT,TT
3852,175,(TTAC)  TrimTabs All Cap U.S. Free-Cash-Flow ETF,Stock Research for TTAC,Covered Calls for TTAC,Option Chain for TTAC,TTAC
3853,176,(TTC)  The Toro Co.,Stock Research for TTC,Covered Calls for TTC,Option Chain for TTC,TTC
3854,177,(TTCF)  Tattooed Chef Inc.,Stock Research for TTCF,Covered Calls for TTCF,Option Chain for TTCF,TTCF
3855,178,(TTD)  Trade Desk Inc. (The),Stock Research for TTD,Covered Calls for TTD,Option Chain for TTD,TTD
3856,179,(TTEC)  TTEC Holdings Inc.,Stock Research for TTEC,Covered Calls for TTEC,Option Chain for TTEC,TTEC
3857,180,(TTEK)  Tetra Tech Inc.,Stock Research for TTEK,Covered Calls for TTEK,Option Chain for TTEK,TTEK
3858,181,(TTGT)  TechTarget Inc.,Stock Research for TTGT,Covered Calls for TTGT,Option Chain for TTGT,TTGT
3859,182,(TTI)  TETRA Techs. Inc.,Stock Research for TTI,Covered Calls for TTI,Option Chain for TTI,TTI
3860,183,(TTM)  Tata Motors Ltd.,Stock Research for TTM,Covered Calls for TTM,Option Chain for TTM,TTM
3861,184,(TTMI)  TTM Technologies Inc.,Stock Research for TTMI,Covered Calls for TTMI,Option Chain for TTMI,TTMI
3862,185,(TTNP)  Titan Pharmaceuticals Inc.,Stock Research for TTNP,Covered Calls for TTNP,Option Chain for TTNP,TTNP
3863,186,(TTOO)  T2 Biosystems Inc.,Stock Research for TTOO,Covered Calls for TTOO,Option Chain for TTOO,TTOO
3864,187,(TTT)  ProShares UltraShort 20+ Year Trsy ETF,Stock Research for TTT,Covered Calls for TTT,Option Chain for TTT,TTT
3865,188,(TTWO)  Take-Two Interactive Software Inc.,Stock Research for TTWO,Covered Calls for TTWO,Option Chain for TTWO,TTWO
3866,189,(TU)  TELUS Corp.,Stock Research for TU,Covered Calls for TU,Option Chain for TU,TU
3867,190,(TUFN)  Tufin Software Technologies Ltd.,Stock Research for TUFN,Covered Calls for TUFN,Option Chain for TUFN,TUFN
3868,191,(TUP)  Tupperware Corp.,Stock Research for TUP,Covered Calls for TUP,Option Chain for TUP,TUP
3869,192,(TUR)  iShares MSCI Turkey Invest Mkt Index ETF,Stock Research for TUR,Covered Calls for TUR,Option Chain for TUR,TUR
3870,193,(TURN)  180 Degree Capital Corp.,Stock Research for TURN,Covered Calls for TURN,Option Chain for TURN,TURN
3871,194,(TUSK)  Mammoth Energy Services Inc.,Stock Research for TUSK,Covered Calls for TUSK,Option Chain for TUSK,TUSK
3872,195,(TV)  Grupo Televisa S.A.B.,Stock Research for TV,Covered Calls for TV,Option Chain for TV,TV
3873,196,(TVTY)  Tivity Health Inc.,Stock Research for TVTY,Covered Calls for TVTY,Option Chain for TVTY,TVTY
3874,197,(TW)  Tradeweb Markets Inc.,Stock Research for TW,Covered Calls for TW,Option Chain for TW,TW
3875,198,(TWI)  Titan International Inc.,Stock Research for TWI,Covered Calls for TWI,Option Chain for TWI,TWI
3876,199,(TWIN)  Twin Disc Inc.,Stock Research for TWIN,Covered Calls for TWIN,Option Chain for TWIN,TWIN
3877,200,(TWLO)  Twilio Inc.,Stock Research for TWLO,Covered Calls for TWLO,Option Chain for TWLO,TWLO
3878,201,(TWM)  ProShares UltraShort Russell 2000 ETF,Stock Research for TWM,Covered Calls for TWM,Option Chain for TWM,TWM
3879,202,(TWNK)  Hostess Brands Inc.,Stock Research for TWNK,Covered Calls for TWNK,Option Chain for TWNK,TWNK
3880,203,(TWO)  Two Harbors Investment Corp.,Stock Research for TWO,Covered Calls for TWO,Option Chain for TWO,TWO
3881,204,(TWOU)  2U Inc.,Stock Research for TWOU,Covered Calls for TWOU,Option Chain for TWOU,TWOU
3882,205,(TWST)  Twist Bioscience Corp.,Stock Research for TWST,Covered Calls for TWST,Option Chain for TWST,TWST
3883,206,(TWTR)  Twitter Inc.,Stock Research for TWTR,Covered Calls for TWTR,Option Chain for TWTR,TWTR
3884,207,(TX)  Ternium S.A.,Stock Research for TX,Covered Calls for TX,Option Chain for TX,TX
3885,208,(TXG)  10x Genomics Inc.,Stock Research for TXG,Covered Calls for TXG,Option Chain for TXG,TXG
3886,209,(TXMD)  TherapeuticsMD Inc.,Stock Research for TXMD,Covered Calls for TXMD,Option Chain for TXMD,TXMD
3887,210,(TXN)  Texas Instruments Inc.,Stock Research for TXN,Covered Calls for TXN,Option Chain for TXN,TXN
3888,211,(TXRH)  Texas Roadhouse Inc.,Stock Research for TXRH,Covered Calls for TXRH,Option Chain for TXRH,TXRH
3889,212,(TXT)  Textron Inc.,Stock Research for TXT,Covered Calls for TXT,Option Chain for TXT,TXT
3890,213,(TYD)  Direxion Daily 7-10 Yr Trs Bull 3X ETF,Stock Research for TYD,Covered Calls for TYD,Option Chain for TYD,TYD
3891,214,(TYL)  Tyler Techs. Inc.,Stock Research for TYL,Covered Calls for TYL,Option Chain for TYL,TYL
3892,215,(TYME)  Tyme Technologies Inc.,Stock Research for TYME,Covered Calls for TYME,Option Chain for TYME,TYME
3893,216,(TYO)  Direxion Daily 10 Yr Trsy BEAR 3X Shares ETF,Stock Research for TYO,Covered Calls for TYO,Option Chain for TYO,TYO
3894,217,(TZA)  Direxion Shares Small Cap BEAR 3x ETF,Stock Research for TZA,Covered Calls for TZA,Option Chain for TZA,TZA
3895,218,(TZOO)  Travelzoo Inc.,Stock Research for TZOO,Covered Calls for TZOO,Option Chain for TZOO,TZOO
3896,0,(U)  Unity Software Inc.,Stock Research for U,Covered Calls for U,Option Chain for U,U
3897,1,(UA)  Under Armour Inc. Class C,Stock Research for UA,Covered Calls for UA,Option Chain for UA,UA
3898,2,(UAA)  Under Armour Inc. Class A,Stock Research for UAA,Covered Calls for UAA,Option Chain for UAA,UAA
3899,3,(UAL)  United Continental Holdings,Stock Research for UAL,Covered Calls for UAL,Option Chain for UAL,UAL
3900,4,(UAMY)  United States Antimony Corp.,Stock Research for UAMY,Covered Calls for UAMY,Option Chain for UAMY,UAMY
3901,5,(UAN)  CVR Partners LP,Stock Research for UAN,Covered Calls for UAN,Option Chain for UAN,UAN
3902,6,(UBA)  Urstadt Biddle Properties Inc.,Stock Research for UBA,Covered Calls for UBA,Option Chain for UBA,UBA
3903,7,(UBER)  Uber Technologies Inc.,Stock Research for UBER,Covered Calls for UBER,Option Chain for UBER,UBER
3904,8,(UBS)  UBS Group AG,Stock Research for UBS,Covered Calls for UBS,Option Chain for UBS,UBS
3905,9,(UBSI)  United Bankshares Inc.,Stock Research for UBSI,Covered Calls for UBSI,Option Chain for UBSI,UBSI
3906,10,(UBT)  ProShares ULTRA 20 Plus Year Treasury ETF,Stock Research for UBT,Covered Calls for UBT,Option Chain for UBT,UBT
3907,11,(UBX)  Unity Biotechnology Inc.,Stock Research for UBX,Covered Calls for UBX,Option Chain for UBX,UBX
3908,12,(UCBI)  United Community Banks Inc.,Stock Research for UCBI,Covered Calls for UCBI,Option Chain for UCBI,UCBI
3909,13,(UCO)  ProShares Ultra DJ-AIG Crude Oil ETF,Stock Research for UCO,Covered Calls for UCO,Option Chain for UCO,UCO
3910,14,(UCTT)  Ultra Clean Holdings Inc.,Stock Research for UCTT,Covered Calls for UCTT,Option Chain for UCTT,UCTT
3911,15,(UDN)  Invesco DB US Dollar Index Bearish ETF,Stock Research for UDN,Covered Calls for UDN,Option Chain for UDN,UDN
3912,16,(UDOW)  ProShares ULTRA PRO DOW 30 ETF,Stock Research for UDOW,Covered Calls for UDOW,Option Chain for UDOW,UDOW
3913,17,(UDR)  UDR Inc.,Stock Research for UDR,Covered Calls for UDR,Option Chain for UDR,UDR
3914,18,(UE)  Urban Edge Properties,Stock Research for UE,Covered Calls for UE,Option Chain for UE,UE
3915,19,(UEC)  Uranium Energy Corp.,Stock Research for UEC,Covered Calls for UEC,Option Chain for UEC,UEC
3916,20,(UEIC)  Universal Electronics Inc.,Stock Research for UEIC,Covered Calls for UEIC,Option Chain for UEIC,UEIC
3917,21,(UEPS)  Net 1 U.E.P.S. Techs. Inc.,Stock Research for UEPS,Covered Calls for UEPS,Option Chain for UEPS,UEPS
3918,22,(UFCS)  United Fire Group Inc.,Stock Research for UFCS,Covered Calls for UFCS,Option Chain for UFCS,UFCS
3919,23,(UFI)  Unifi Inc.,Stock Research for UFI,Covered Calls for UFI,Option Chain for UFI,UFI
3920,24,(UFPI)  Universal Forest Products Inc.,Stock Research for UFPI,Covered Calls for UFPI,Option Chain for UFPI,UFPI
3921,25,(UFS)  Domtar Corp.,Stock Research for UFS,Covered Calls for UFS,Option Chain for UFS,UFS
3922,26,(UGA)  United States Gasoline Fund LP,Stock Research for UGA,Covered Calls for UGA,Option Chain for UGA,UGA
3923,27,(UGI)  UGI Corp.,Stock Research for UGI,Covered Calls for UGI,Option Chain for UGI,UGI
3924,28,(UGL)  ProShares Ultra Gold ETF,Stock Research for UGL,Covered Calls for UGL,Option Chain for UGL,UGL
3925,29,(UGP)  Ultrapar Holdings Inc.,Stock Research for UGP,Covered Calls for UGP,Option Chain for UGP,UGP
3926,30,(UHAL)  AMERCO,Stock Research for UHAL,Covered Calls for UHAL,Option Chain for UHAL,UHAL
3927,31,(UHS)  Universal Health Services Inc.,Stock Research for UHS,Covered Calls for UHS,Option Chain for UHS,UHS
3928,32,(UHT)  Universal Health Realty Income Trust,Stock Research for UHT,Covered Calls for UHT,Option Chain for UHT,UHT
3929,33,(UI)  Ubiquiti Inc.,Stock Research for UI,Covered Calls for UI,Option Chain for UI,UI
3930,34,(UIHC)  United Insurance Holdings Corp.,Stock Research for UIHC,Covered Calls for UIHC,Option Chain for UIHC,UIHC
3931,35,(UIS)  Unisys Corp.,Stock Research for UIS,Covered Calls for UIS,Option Chain for UIS,UIS
3932,36,(UL)  Unilever PLC ADR,Stock Research for UL,Covered Calls for UL,Option Chain for UL,UL
3933,37,(ULBI)  Ultralife Batteries Inc.,Stock Research for ULBI,Covered Calls for ULBI,Option Chain for ULBI,ULBI
3934,38,(ULE)  ProShares Ultra Euro ETF,Stock Research for ULE,Covered Calls for ULE,Option Chain for ULE,ULE
3935,39,(ULTA)  Ulta Beauty Inc.,Stock Research for ULTA,Covered Calls for ULTA,Option Chain for ULTA,ULTA
3936,40,(UMBF)  UMB Financial Corp.,Stock Research for UMBF,Covered Calls for UMBF,Option Chain for UMBF,UMBF
3937,41,(UMC)  United Microelectronics Corp.,Stock Research for UMC,Covered Calls for UMC,Option Chain for UMC,UMC
3938,42,(UMDD)  ProShares ULTRA PRO MidCap 400 ETF,Stock Research for UMDD,Covered Calls for UMDD,Option Chain for UMDD,UMDD
3939,43,(UMH)  UMH Properties Inc.,Stock Research for UMH,Covered Calls for UMH,Option Chain for UMH,UMH
3940,44,(UMPQ)  Umpqua Holdings Corp.,Stock Research for UMPQ,Covered Calls for UMPQ,Option Chain for UMPQ,UMPQ
3941,45,(UN)  Unilever NV,Stock Research for UN,Covered Calls for UN,Option Chain for UN,UN
3942,46,(UNF)  UniFirst Corp.,Stock Research for UNF,Covered Calls for UNF,Option Chain for UNF,UNF
3943,47,(UNFI)  United Natural Foods Inc.,Stock Research for UNFI,Covered Calls for UNFI,Option Chain for UNFI,UNFI
3944,48,(UNG)  United States Natural Gas Fund LP,Stock Research for UNG,Covered Calls for UNG,Option Chain for UNG,UNG
3945,49,(UNH)  UnitedHealth Group Inc.,Stock Research for UNH,Covered Calls for UNH,Option Chain for UNH,UNH
3946,50,(UNIT)  Uniti Group Inc.,Stock Research for UNIT,Covered Calls for UNIT,Option Chain for UNIT,UNIT
3947,51,(UNL)  United States 12 Month Natural Gas Fund LP,Stock Research for UNL,Covered Calls for UNL,Option Chain for UNL,UNL
