,index,Company  Name,Details,Quick  Find,Option  Chain,Symbol
2557,190,(MTL)  Mechel Open Joint Stock Co.,Stock Research for MTL,Covered Calls for MTL,Option Chain for MTL,MTL
2558,191,(MTLS)  Materialise NV,Stock Research for MTLS,Covered Calls for MTLS,Option Chain for MTLS,MTLS
2559,192,(MTN)  Vail Resorts Inc.,Stock Research for MTN,Covered Calls for MTN,Option Chain for MTN,MTN
2560,193,(MTOR)  Meritor Inc.,Stock Research for MTOR,Covered Calls for MTOR,Option Chain for MTOR,MTOR
2561,194,(MTRN)  Materion Corp.,Stock Research for MTRN,Covered Calls for MTRN,Option Chain for MTRN,MTRN
2562,195,(MTRX)  Matrix Service Co.,Stock Research for MTRX,Covered Calls for MTRX,Option Chain for MTRX,MTRX
2563,196,(MTSC)  MTS Systems Corp.,Stock Research for MTSC,Covered Calls for MTSC,Option Chain for MTSC,MTSC
2564,197,(MTSI)  MACOM Technology Solutions Holdings Inc.,Stock Research for MTSI,Covered Calls for MTSI,Option Chain for MTSI,MTSI
2565,198,(MTUM)  iShares Edge MSCI USA Momentum Factor ETF,Stock Research for MTUM,Covered Calls for MTUM,Option Chain for MTUM,MTUM
2566,199,(MTW)  Manitowoc Co. Inc.,Stock Research for MTW,Covered Calls for MTW,Option Chain for MTW,MTW
2567,200,(MTX)  Minerals Techs. Inc.,Stock Research for MTX,Covered Calls for MTX,Option Chain for MTX,MTX
2568,201,(MTZ)  MasTec Inc.,Stock Research for MTZ,Covered Calls for MTZ,Option Chain for MTZ,MTZ
2569,202,(MU)  Micron Technology Inc.,Stock Research for MU,Covered Calls for MU,Option Chain for MU,MU
2570,203,(MUB)  iShares S&P National AMT-Free Muni. Bond Index ETF,Stock Research for MUB,Covered Calls for MUB,Option Chain for MUB,MUB
2571,204,(MUFG)  Mitsubishi UFJ Financial Group Inc.,Stock Research for MUFG,Covered Calls for MUFG,Option Chain for MUFG,MUFG
2572,205,(MUNI)  PIMCO Intermediate Municipal Bond ETF,Stock Research for MUNI,Covered Calls for MUNI,Option Chain for MUNI,MUNI
2573,206,(MUR)  Murphy Oil Corp.,Stock Research for MUR,Covered Calls for MUR,Option Chain for MUR,MUR
2574,207,(MUSA)  Murphy USA Inc.,Stock Research for MUSA,Covered Calls for MUSA,Option Chain for MUSA,MUSA
2575,208,(MUX)  McEwen Mining Inc.,Stock Research for MUX,Covered Calls for MUX,Option Chain for MUX,MUX
2576,209,(MVC)  MVC Capital Inc.,Stock Research for MVC,Covered Calls for MVC,Option Chain for MVC,MVC
2577,210,(MVIS)  Microvision Inc.,Stock Research for MVIS,Covered Calls for MVIS,Option Chain for MVIS,MVIS
2578,211,(MVO)  MV Oil Trust,Stock Research for MVO,Covered Calls for MVO,Option Chain for MVO,MVO
2579,212,(MWA)  Mueller Water Products Inc.,Stock Research for MWA,Covered Calls for MWA,Option Chain for MWA,MWA
2580,213,(MX)  MagnaChip Semiconductor Corp.,Stock Research for MX,Covered Calls for MX,Option Chain for MX,MX
2581,214,(MXI)  iShares Global Materials ETF,Stock Research for MXI,Covered Calls for MXI,Option Chain for MXI,MXI
2582,215,(MXIM)  Maxim Integrated Products Inc.,Stock Research for MXIM,Covered Calls for MXIM,Option Chain for MXIM,MXIM
2583,216,(MXL)  MaxLinear Inc.,Stock Research for MXL,Covered Calls for MXL,Option Chain for MXL,MXL
2584,217,(MYE)  Myers Industries Inc.,Stock Research for MYE,Covered Calls for MYE,Option Chain for MYE,MYE
2585,218,(MYGN)  Myriad Genetics Inc.,Stock Research for MYGN,Covered Calls for MYGN,Option Chain for MYGN,MYGN
2586,219,(MYL)  Mylan NV,Stock Research for MYL,Covered Calls for MYL,Option Chain for MYL,MYL
2587,220,(MYOK)  MyoKardia Inc.,Stock Research for MYOK,Covered Calls for MYOK,Option Chain for MYOK,MYOK
2588,221,(MYOV)  Myovant Sciences Ltd.,Stock Research for MYOV,Covered Calls for MYOV,Option Chain for MYOV,MYOV
2589,222,(MYRG)  MYR Group Inc.,Stock Research for MYRG,Covered Calls for MYRG,Option Chain for MYRG,MYRG
2590,223,(MYY)  ProShares Short MidCap400 ETF,Stock Research for MYY,Covered Calls for MYY,Option Chain for MYY,MYY
2591,224,(MZZ)  ProShares UltraShort MidCap400 ETF,Stock Research for MZZ,Covered Calls for MZZ,Option Chain for MZZ,MZZ
2592,0,(NAIL)  Direxion Daily Homebuilders & Supplies Bull 3X ETF,Stock Research for NAIL,Covered Calls for NAIL,Option Chain for NAIL,NAIL
2593,1,(NAK)  Northern Dynasty Minerals Ltd.,Stock Research for NAK,Covered Calls for NAK,Option Chain for NAK,NAK
2594,2,(NANR)  SPDR S&P North American Natural Res ETF,Stock Research for NANR,Covered Calls for NANR,Option Chain for NANR,NANR
2595,3,(NARI)  Inari Medical Inc.,Stock Research for NARI,Covered Calls for NARI,Option Chain for NARI,NARI
2596,4,(NAT)  Nordic American Tankers Ltd.,Stock Research for NAT,Covered Calls for NAT,Option Chain for NAT,NAT
2597,5,(NATI)  National Instruments Corp.,Stock Research for NATI,Covered Calls for NATI,Option Chain for NATI,NATI
2598,6,(NAV)  Navistar Intl. Corp.,Stock Research for NAV,Covered Calls for NAV,Option Chain for NAV,NAV
2599,7,(NAVB)  Navidea Biopharmaceuticals Inc.,Stock Research for NAVB,Covered Calls for NAVB,Option Chain for NAVB,NAVB
2600,8,(NAVI)  Navient Corp.,Stock Research for NAVI,Covered Calls for NAVI,Option Chain for NAVI,NAVI
2601,9,(NBEV)  New Age Beverages Corp.,Stock Research for NBEV,Covered Calls for NBEV,Option Chain for NBEV,NBEV
2602,10,(NBHC)  National Bank Holdings Corp.,Stock Research for NBHC,Covered Calls for NBHC,Option Chain for NBHC,NBHC
2603,11,(NBIX)  Neurocrine Bios,Stock Research for NBIX,Covered Calls for NBIX,Option Chain for NBIX,NBIX
2604,12,(NBLX)  Noble Midstream Partners LP,Stock Research for NBLX,Covered Calls for NBLX,Option Chain for NBLX,NBLX
2605,13,(NBR)  Nabors Indus. Inc.,Stock Research for NBR,Covered Calls for NBR,Option Chain for NBR,NBR
2606,14,(NBRV)  Nabriva Therapeutics plc,Stock Research for NBRV,Covered Calls for NBRV,Option Chain for NBRV,NBRV
2607,15,(NBSE)  NeuBase Therapeutics Inc.,Stock Research for NBSE,Covered Calls for NBSE,Option Chain for NBSE,NBSE
2608,16,(NBTB)  NBT Bancorp Inc.,Stock Research for NBTB,Covered Calls for NBTB,Option Chain for NBTB,NBTB
2609,17,(NCLH)  Norwegian Cruise Line Holdings Ltd.,Stock Research for NCLH,Covered Calls for NCLH,Option Chain for NCLH,NCLH
2610,18,(NCMI)  National CineMedia Inc.,Stock Research for NCMI,Covered Calls for NCMI,Option Chain for NCMI,NCMI
2611,19,(NCNO)  nCino Inc.,Stock Research for NCNO,Covered Calls for NCNO,Option Chain for NCNO,NCNO
2612,20,(NCR)  NCR Corp.,Stock Research for NCR,Covered Calls for NCR,Option Chain for NCR,NCR
2613,21,(NCTY)  The9 Ltd.,Stock Research for NCTY,Covered Calls for NCTY,Option Chain for NCTY,NCTY
2614,22,(NDAQ)  Nasdaq Inc.,Stock Research for NDAQ,Covered Calls for NDAQ,Option Chain for NDAQ,NDAQ
2615,23,(NDLS)  Noodles & Company,Stock Research for NDLS,Covered Calls for NDLS,Option Chain for NDLS,NDLS
2616,24,(NDSN)  Nordson Corp.,Stock Research for NDSN,Covered Calls for NDSN,Option Chain for NDSN,NDSN
2617,25,(NEBLQ)  Noble Corp. plc,Stock Research for NEBLQ,Covered Calls for NEBLQ,Option Chain for NEBLQ,NEBLQ
2618,26,(NEE)  NextEra Energy Inc.,Stock Research for NEE,Covered Calls for NEE,Option Chain for NEE,NEE
2619,27,(NEM)  Newmont Mining Corp.,Stock Research for NEM,Covered Calls for NEM,Option Chain for NEM,NEM
2620,28,(NEO)  Neogenomics Inc.,Stock Research for NEO,Covered Calls for NEO,Option Chain for NEO,NEO
2621,29,(NEOG)  Neogen Corp.,Stock Research for NEOG,Covered Calls for NEOG,Option Chain for NEOG,NEOG
2622,30,(NEOS)  Neos Therapeutics Inc.,Stock Research for NEOS,Covered Calls for NEOS,Option Chain for NEOS,NEOS
2623,31,(NEP)  NextEra Energy Partners LP,Stock Research for NEP,Covered Calls for NEP,Option Chain for NEP,NEP
2624,32,(NEPT)  Neptune Technologies & Bioresources Inc.,Stock Research for NEPT,Covered Calls for NEPT,Option Chain for NEPT,NEPT
2625,33,(NERD)  Roundhill BITKRAFT Esports & Digital Entert. ETF,Stock Research for NERD,Covered Calls for NERD,Option Chain for NERD,NERD
2626,34,(NERV)  Minerva Neurosciences Inc.,Stock Research for NERV,Covered Calls for NERV,Option Chain for NERV,NERV
2627,35,(NET)  Cloudflare Inc.,Stock Research for NET,Covered Calls for NET,Option Chain for NET,NET
2628,36,(NEU)  NewMarket Corp.,Stock Research for NEU,Covered Calls for NEU,Option Chain for NEU,NEU
2629,37,(NEW)  Puxin Ltd,Stock Research for NEW,Covered Calls for NEW,Option Chain for NEW,NEW
2630,38,(NEWR)  New Relic Inc.,Stock Research for NEWR,Covered Calls for NEWR,Option Chain for NEWR,NEWR
2631,39,(NEWT)  Newtek Business Services Corp.,Stock Research for NEWT,Covered Calls for NEWT,Option Chain for NEWT,NEWT
2632,40,(NEX)  NexTier Oilfield Solutions Inc.,Stock Research for NEX,Covered Calls for NEX,Option Chain for NEX,NEX
2633,41,(NFBK)  Northfield Bancorp Inc.,Stock Research for NFBK,Covered Calls for NFBK,Option Chain for NFBK,NFBK
2634,42,(NFE)  New Fortress Energy LLC,Stock Research for NFE,Covered Calls for NFE,Option Chain for NFE,NFE
2635,43,(NFG)  National Fuel Gas Co.,Stock Research for NFG,Covered Calls for NFG,Option Chain for NFG,NFG
2636,44,(NFIN)  Netfin Acquisition Corp.,Stock Research for NFIN,Covered Calls for NFIN,Option Chain for NFIN,NFIN
2637,45,(NFLX)  Netflix Inc.,Stock Research for NFLX,Covered Calls for NFLX,Option Chain for NFLX,NFLX
2638,46,(NG)  Novagold Resources Inc.,Stock Research for NG,Covered Calls for NG,Option Chain for NG,NG
2639,47,(NGD)  New Gold Inc.,Stock Research for NGD,Covered Calls for NGD,Option Chain for NGD,NGD
2640,48,(NGG)  National Grid PLC,Stock Research for NGG,Covered Calls for NGG,Option Chain for NGG,NGG
2641,49,(NGHC)  National General Holdings Corp.,Stock Research for NGHC,Covered Calls for NGHC,Option Chain for NGHC,NGHC
2642,50,(NGL)  NGL Energy Partners LP,Stock Research for NGL,Covered Calls for NGL,Option Chain for NGL,NGL
2643,51,(NGM)  NGM Biopharmaceuticals Inc.,Stock Research for NGM,Covered Calls for NGM,Option Chain for NGM,NGM
2644,52,(NGS)  Natural Gas Srvs. Group Inc.,Stock Research for NGS,Covered Calls for NGS,Option Chain for NGS,NGS
2645,53,(NGVC)  Natural Grocers by Vitamin Cottage Inc.,Stock Research for NGVC,Covered Calls for NGVC,Option Chain for NGVC,NGVC
2646,54,(NGVT)  Ingevity Corp.,Stock Research for NGVT,Covered Calls for NGVT,Option Chain for NGVT,NGVT
2647,55,(NH)  NantHealth Inc.,Stock Research for NH,Covered Calls for NH,Option Chain for NH,NH
2648,56,(NHC)  National Healthcare Corp.,Stock Research for NHC,Covered Calls for NHC,Option Chain for NHC,NHC
2649,57,(NHI)  National Health Investors Inc.,Stock Research for NHI,Covered Calls for NHI,Option Chain for NHI,NHI
2650,58,(NHTC)  Natural Health Trends Corp.,Stock Research for NHTC,Covered Calls for NHTC,Option Chain for NHTC,NHTC
2651,59,(NI)  NiSource Inc.,Stock Research for NI,Covered Calls for NI,Option Chain for NI,NI
2652,60,(NIB)  iPath Bloomberg Cocoa Subindex Total Return ETN,Stock Research for NIB,Covered Calls for NIB,Option Chain for NIB,NIB
2653,61,(NICE)  NICE Systems Ltd. ADR,Stock Research for NICE,Covered Calls for NICE,Option Chain for NICE,NICE
2654,62,(NINE)  Nine Energy Service Inc.,Stock Research for NINE,Covered Calls for NINE,Option Chain for NINE,NINE
2655,63,(NIO)  NIO Inc.,Stock Research for NIO,Covered Calls for NIO,Option Chain for NIO,NIO
2656,64,(NIU)  Niu Technologies,Stock Research for NIU,Covered Calls for NIU,Option Chain for NIU,NIU
2657,65,(NJR)  New Jersey Resources Corp.,Stock Research for NJR,Covered Calls for NJR,Option Chain for NJR,NJR
2658,66,(NK)  NantKwest Inc.,Stock Research for NK,Covered Calls for NK,Option Chain for NK,NK
2659,67,(NKE)  Nike Inc.,Stock Research for NKE,Covered Calls for NKE,Option Chain for NKE,NKE
2660,68,(NKLA)  Nikola Corp.,Stock Research for NKLA,Covered Calls for NKLA,Option Chain for NKLA,NKLA
2661,69,(NKTR)  Nektar Therapeutics,Stock Research for NKTR,Covered Calls for NKTR,Option Chain for NKTR,NKTR
2662,70,(NL)  NL Industries Inc.,Stock Research for NL,Covered Calls for NL,Option Chain for NL,NL
2663,71,(NLOK)  NortonLifeLock Inc.,Stock Research for NLOK,Covered Calls for NLOK,Option Chain for NLOK,NLOK
2664,72,(NLS)  Nautilus Group Inc.,Stock Research for NLS,Covered Calls for NLS,Option Chain for NLS,NLS
2665,73,(NLSN)  Nielsen Holdings plc,Stock Research for NLSN,Covered Calls for NLSN,Option Chain for NLSN,NLSN
2666,74,(NLTX)  Neoleukin Therapeutics Inc.,Stock Research for NLTX,Covered Calls for NLTX,Option Chain for NLTX,NLTX
2667,75,(NLY)  Annaly Capital Management Inc.,Stock Research for NLY,Covered Calls for NLY,Option Chain for NLY,NLY
2668,76,(NM)  Navios Maritime Holdings Inc.,Stock Research for NM,Covered Calls for NM,Option Chain for NM,NM
2669,77,(NMFC)  New Mountain Finance Corp.,Stock Research for NMFC,Covered Calls for NMFC,Option Chain for NMFC,NMFC
2670,78,(NMIH)  NMI Holdings Inc.,Stock Research for NMIH,Covered Calls for NMIH,Option Chain for NMIH,NMIH
2671,79,(NMM)  Navios Maritime Partners LP,Stock Research for NMM,Covered Calls for NMM,Option Chain for NMM,NMM
2672,80,(NMR)  Nomura Holdings Inc.,Stock Research for NMR,Covered Calls for NMR,Option Chain for NMR,NMR
2673,81,(NMRD)  Nemaura Medical Inc.,Stock Research for NMRD,Covered Calls for NMRD,Option Chain for NMRD,NMRD
2674,82,(NMRK)  Newmark Group Inc.,Stock Research for NMRK,Covered Calls for NMRK,Option Chain for NMRK,NMRK
2675,83,(NMTR)  9 Meters Biopharma Inc.,Stock Research for NMTR,Covered Calls for NMTR,Option Chain for NMTR,NMTR
2676,84,(NNA)  Navios Maritime Acquisition Corp.,Stock Research for NNA,Covered Calls for NNA,Option Chain for NNA,NNA
2677,85,(NNBR)  NN Inc.,Stock Research for NNBR,Covered Calls for NNBR,Option Chain for NNBR,NNBR
2678,86,(NNDM)  Nano Dimension Ltd.,Stock Research for NNDM,Covered Calls for NNDM,Option Chain for NNDM,NNDM
2679,87,(NNI)  Nelnet Inc.,Stock Research for NNI,Covered Calls for NNI,Option Chain for NNI,NNI
2680,88,(NNN)  National Retail Properties Inc.,Stock Research for NNN,Covered Calls for NNN,Option Chain for NNN,NNN
2681,89,(NNOX)  Nano-X Imaging Ltd.,Stock Research for NNOX,Covered Calls for NNOX,Option Chain for NNOX,NNOX
2682,90,(NNVC)  NanoViricides Inc.,Stock Research for NNVC,Covered Calls for NNVC,Option Chain for NNVC,NNVC
2683,91,(NOA)  North American Construction Group Ltd.,Stock Research for NOA,Covered Calls for NOA,Option Chain for NOA,NOA
2684,92,(NOAH)  Noah Holdings Ltd. ADR,Stock Research for NOAH,Covered Calls for NOAH,Option Chain for NOAH,NOAH
2685,93,(NOBL)  ProShares Dividend Aristocrats ETF,Stock Research for NOBL,Covered Calls for NOBL,Option Chain for NOBL,NOBL
2686,94,(NOC)  Northrop Grumman Corp.,Stock Research for NOC,Covered Calls for NOC,Option Chain for NOC,NOC
2687,95,(NOG)  Northern Oil and Gas Inc.,Stock Research for NOG,Covered Calls for NOG,Option Chain for NOG,NOG
2688,96,(NOK)  Nokia Corp. ADR,Stock Research for NOK,Covered Calls for NOK,Option Chain for NOK,NOK
2689,97,(NOMD)  Nomad Foods Ltd,Stock Research for NOMD,Covered Calls for NOMD,Option Chain for NOMD,NOMD
2690,98,(NOV)  National Oilwell Varco Inc.,Stock Research for NOV,Covered Calls for NOV,Option Chain for NOV,NOV
2691,99,(NOVA)  Sunnova Energy International Inc.,Stock Research for NOVA,Covered Calls for NOVA,Option Chain for NOVA,NOVA
2692,100,(NOVS)  Novus Capital Corp.,Stock Research for NOVS,Covered Calls for NOVS,Option Chain for NOVS,NOVS
2693,101,(NOVT)  Novanta Inc.,Stock Research for NOVT,Covered Calls for NOVT,Option Chain for NOVT,NOVT
2694,102,(NOW)  ServiceNow Inc.,Stock Research for NOW,Covered Calls for NOW,Option Chain for NOW,NOW
2695,103,(NP)  Neenah Paper Inc.,Stock Research for NP,Covered Calls for NP,Option Chain for NP,NP
2696,104,(NPO)  EnPro Industries Inc.,Stock Research for NPO,Covered Calls for NPO,Option Chain for NPO,NPO
2697,105,(NPTN)  NeoPhotonics Corp.,Stock Research for NPTN,Covered Calls for NPTN,Option Chain for NPTN,NPTN
2698,106,(NR)  Newpark Resources Inc.,Stock Research for NR,Covered Calls for NR,Option Chain for NR,NR
2699,107,(NRG)  NRG Energy Inc.,Stock Research for NRG,Covered Calls for NRG,Option Chain for NRG,NRG
2700,108,(NRP)  Natural Resource Partners LP,Stock Research for NRP,Covered Calls for NRP,Option Chain for NRP,NRP
2701,109,(NRT)  North European Oil Royalty Trust,Stock Research for NRT,Covered Calls for NRT,Option Chain for NRT,NRT
2702,110,(NRZ)  New Residential Investment Corp.,Stock Research for NRZ,Covered Calls for NRZ,Option Chain for NRZ,NRZ
2703,111,(NS)  NuStar Energy LP,Stock Research for NS,Covered Calls for NS,Option Chain for NS,NS
2704,112,(NSA)  National Storage Affiliates Trust,Stock Research for NSA,Covered Calls for NSA,Option Chain for NSA,NSA
2705,113,(NSC)  Norfolk Southern Corp.,Stock Research for NSC,Covered Calls for NSC,Option Chain for NSC,NSC
2706,114,(NSCO)  Nesco Holdings Inc.,Stock Research for NSCO,Covered Calls for NSCO,Option Chain for NSCO,NSCO
2707,115,(NSIT)  Insight Enterprises Inc.,Stock Research for NSIT,Covered Calls for NSIT,Option Chain for NSIT,NSIT
2708,116,(NSP)  Insperity Inc.,Stock Research for NSP,Covered Calls for NSP,Option Chain for NSP,NSP
2709,117,(NSSC)  Napco Security Technologies Inc.,Stock Research for NSSC,Covered Calls for NSSC,Option Chain for NSSC,NSSC
2710,118,(NSTG)  NanoString Technologies Inc.,Stock Research for NSTG,Covered Calls for NSTG,Option Chain for NSTG,NSTG
2711,119,(NTAP)  NetApp Inc.,Stock Research for NTAP,Covered Calls for NTAP,Option Chain for NTAP,NTAP
2712,120,(NTCT)  NetScout Systems Inc.,Stock Research for NTCT,Covered Calls for NTCT,Option Chain for NTCT,NTCT
2713,121,(NTEC)  Intec Pharma Ltd.,Stock Research for NTEC,Covered Calls for NTEC,Option Chain for NTEC,NTEC
2714,122,(NTES)  Netease.com Inc. ADR,Stock Research for NTES,Covered Calls for NTES,Option Chain for NTES,NTES
2715,123,(NTGR)  NETGEAR Inc.,Stock Research for NTGR,Covered Calls for NTGR,Option Chain for NTGR,NTGR
2716,124,(NTLA)  Intellia Therapeutics Inc.,Stock Research for NTLA,Covered Calls for NTLA,Option Chain for NTLA,NTLA
2717,125,(NTNX)  Nutanix Inc.,Stock Research for NTNX,Covered Calls for NTNX,Option Chain for NTNX,NTNX
2718,126,(NTP)  Nam Tai Property Inc.,Stock Research for NTP,Covered Calls for NTP,Option Chain for NTP,NTP
2719,127,(NTR)  Nutrien Ltd.,Stock Research for NTR,Covered Calls for NTR,Option Chain for NTR,NTR
2720,128,(NTRA)  Natera Inc.,Stock Research for NTRA,Covered Calls for NTRA,Option Chain for NTRA,NTRA
2721,129,(NTRP)  Neurotrope Inc.,Stock Research for NTRP,Covered Calls for NTRP,Option Chain for NTRP,NTRP
2722,130,(NTRS)  Northern Trust Corp.,Stock Research for NTRS,Covered Calls for NTRS,Option Chain for NTRS,NTRS
2723,131,(NTUS)  Natus Medical Inc.,Stock Research for NTUS,Covered Calls for NTUS,Option Chain for NTUS,NTUS
2724,132,(NTWK)  NetSol Technologies Inc.,Stock Research for NTWK,Covered Calls for NTWK,Option Chain for NTWK,NTWK
2725,133,(NUAN)  Nuance Comms.,Stock Research for NUAN,Covered Calls for NUAN,Option Chain for NUAN,NUAN
2726,134,(NUE)  Nucor Corp.,Stock Research for NUE,Covered Calls for NUE,Option Chain for NUE,NUE
2727,135,(NUGT)  Direxion Daily Gold Miners Bull 3x ETF,Stock Research for NUGT,Covered Calls for NUGT,Option Chain for NUGT,NUGT
2728,136,(NUS)  Nu Skin Enterprises Inc.,Stock Research for NUS,Covered Calls for NUS,Option Chain for NUS,NUS
2729,137,(NUVA)  NuVasive Inc.,Stock Research for NUVA,Covered Calls for NUVA,Option Chain for NUVA,NUVA
2730,138,(NVAX)  Novavax Inc.,Stock Research for NVAX,Covered Calls for NVAX,Option Chain for NVAX,NVAX
2731,139,(NVCR)  NovoCure Ltd,Stock Research for NVCR,Covered Calls for NVCR,Option Chain for NVCR,NVCR
2732,140,(NVDA)  NVIDIA Corp.,Stock Research for NVDA,Covered Calls for NVDA,Option Chain for NVDA,NVDA
2733,141,(NVEE)  NV5 Global Inc.,Stock Research for NVEE,Covered Calls for NVEE,Option Chain for NVEE,NVEE
2734,142,(NVGS)  Navigator Holdings Ltd.,Stock Research for NVGS,Covered Calls for NVGS,Option Chain for NVGS,NVGS
2735,143,(NVMI)  Nova Measuring Instruments Ltd.,Stock Research for NVMI,Covered Calls for NVMI,Option Chain for NVMI,NVMI
2736,144,(NVO)  Novo Nordisk AS ADR,Stock Research for NVO,Covered Calls for NVO,Option Chain for NVO,NVO
2737,145,(NVRO)  Nevro Corp.,Stock Research for NVRO,Covered Calls for NVRO,Option Chain for NVRO,NVRO
2738,146,(NVS)  Novartis AG,Stock Research for NVS,Covered Calls for NVS,Option Chain for NVS,NVS
2739,147,(NVST)  Envista Holdings Corp.,Stock Research for NVST,Covered Calls for NVST,Option Chain for NVST,NVST
2740,148,(NVT)  nVent Electric plc,Stock Research for NVT,Covered Calls for NVT,Option Chain for NVT,NVT
2741,149,(NVTA)  Invitae Corp.,Stock Research for NVTA,Covered Calls for NVTA,Option Chain for NVTA,NVTA
2742,150,(NWBI)  Northwest Bancorp Inc.,Stock Research for NWBI,Covered Calls for NWBI,Option Chain for NWBI,NWBI
2743,151,(NWE)  Northwestern Corp.,Stock Research for NWE,Covered Calls for NWE,Option Chain for NWE,NWE
2744,152,(NWG)  Royal Bank of Scotland Group plc,Stock Research for NWG,Covered Calls for NWG,Option Chain for NWG,NWG
2745,153,(NWL)  Newell Brands Inc.,Stock Research for NWL,Covered Calls for NWL,Option Chain for NWL,NWL
2746,154,(NWN)  Northwest Natural Gas Co.,Stock Research for NWN,Covered Calls for NWN,Option Chain for NWN,NWN
2747,155,(NWPX)  Northwest Pipe Co.,Stock Research for NWPX,Covered Calls for NWPX,Option Chain for NWPX,NWPX
2748,156,(NWS)  News Corp. Class B,Stock Research for NWS,Covered Calls for NWS,Option Chain for NWS,NWS
2749,157,(NWSA)  News Corp. Class A,Stock Research for NWSA,Covered Calls for NWSA,Option Chain for NWSA,NWSA
2750,158,(NX)  Quanex Building Products Corp.,Stock Research for NX,Covered Calls for NX,Option Chain for NX,NX
2751,159,(NXGN)  Nextgen Healthcare Inc.,Stock Research for NXGN,Covered Calls for NXGN,Option Chain for NXGN,NXGN
2752,160,(NXPI)  NXP Semiconductors NV,Stock Research for NXPI,Covered Calls for NXPI,Option Chain for NXPI,NXPI
2753,161,(NXRT)  NexPoint Residential Trust Inc.,Stock Research for NXRT,Covered Calls for NXRT,Option Chain for NXRT,NXRT
2754,162,(NXST)  Nexstar Media Group Inc.,Stock Research for NXST,Covered Calls for NXST,Option Chain for NXST,NXST
2755,163,(NXTC)  NextCure Inc.,Stock Research for NXTC,Covered Calls for NXTC,Option Chain for NXTC,NXTC
2756,164,(NXTD)  Nxt-ID Inc.,Stock Research for NXTD,Covered Calls for NXTD,Option Chain for NXTD,NXTD
2757,165,(NYCB)  New York Community Bancorp Inc,Stock Research for NYCB,Covered Calls for NYCB,Option Chain for NYCB,NYCB
2758,166,(NYMT)  New York Mortgage Trust Inc.,Stock Research for NYMT,Covered Calls for NYMT,Option Chain for NYMT,NYMT
2759,167,(NYMX)  Nymox Pharmaceutical Corp.,Stock Research for NYMX,Covered Calls for NYMX,Option Chain for NYMX,NYMX
2760,168,(NYT)  New York Times Company (The) Class A,Stock Research for NYT,Covered Calls for NYT,Option Chain for NYT,NYT
2761,0,(O)  Realty Income Corp.,Stock Research for O,Covered Calls for O,Option Chain for O,O
2762,1,(OBELF)  Obsidian Energy Ltd.,Stock Research for OBELF,Covered Calls for OBELF,Option Chain for OBELF,OBELF
2763,2,(OBSV)  ObsEva SA,Stock Research for OBSV,Covered Calls for OBSV,Option Chain for OBSV,OBSV
2764,3,(OC)  Owens Corning,Stock Research for OC,Covered Calls for OC,Option Chain for OC,OC
2765,4,(OCFC)  OceanFirst Financial Corp.,Stock Research for OCFC,Covered Calls for OCFC,Option Chain for OCFC,OCFC
2766,5,(OCFT)  OneConnect Financial Technology Co. Ltd.,Stock Research for OCFT,Covered Calls for OCFT,Option Chain for OCFT,OCFT
2767,6,(OCN)  Ocwen Financial Corp.,Stock Research for OCN,Covered Calls for OCN,Option Chain for OCN,OCN
2768,7,(OCSI)  Oaktree Strategic Income Corp.,Stock Research for OCSI,Covered Calls for OCSI,Option Chain for OCSI,OCSI
2769,8,(OCSL)  Oaktree Specialty Lending Corp.,Stock Research for OCSL,Covered Calls for OCSL,Option Chain for OCSL,OCSL
2770,9,(OCUL)  Ocular Therapeutix Inc.,Stock Research for OCUL,Covered Calls for OCUL,Option Chain for OCUL,OCUL
2771,10,(OCX)  OncoCyte Corp,Stock Research for OCX,Covered Calls for OCX,Option Chain for OCX,OCX
2772,11,(ODFL)  Old Dominion Freight Line Inc.,Stock Research for ODFL,Covered Calls for ODFL,Option Chain for ODFL,ODFL
2773,12,(ODP)  Office Depot Inc.,Stock Research for ODP,Covered Calls for ODP,Option Chain for ODP,ODP
2774,13,(ODT)  Odonate Therapeutics Inc.,Stock Research for ODT,Covered Calls for ODT,Option Chain for ODT,ODT
2775,14,(OEC)  Orion Engineered Carbons SA,Stock Research for OEC,Covered Calls for OEC,Option Chain for OEC,OEC
2776,15,(OEF)  iShares S&P 100 ETF,Stock Research for OEF,Covered Calls for OEF,Option Chain for OEF,OEF
2777,16,(OEG)  Orbital Energy Group Inc.,Stock Research for OEG,Covered Calls for OEG,Option Chain for OEG,OEG
2778,17,(OESX)  Orion Energy Systems Inc.,Stock Research for OESX,Covered Calls for OESX,Option Chain for OESX,OESX
2779,18,(OFC)  Corporate Office Properties Trust Inc. REIT,Stock Research for OFC,Covered Calls for OFC,Option Chain for OFC,OFC
2780,19,(OFG)  Oriental Financial Group Inc.,Stock Research for OFG,Covered Calls for OFG,Option Chain for OFG,OFG
2781,20,(OFIX)  Orthofix International NV,Stock Research for OFIX,Covered Calls for OFIX,Option Chain for OFIX,OFIX
2782,21,(OGE)  OGE Energy Corp.,Stock Research for OGE,Covered Calls for OGE,Option Chain for OGE,OGE
2783,22,(OGI)  OrganiGram Holdings Inc.,Stock Research for OGI,Covered Calls for OGI,Option Chain for OGI,OGI
2784,23,(OGIG)  O`Shares Global Internet Giants ETF,Stock Research for OGIG,Covered Calls for OGIG,Option Chain for OGIG,OGIG
2785,24,(OGS)  ONE Gas,Stock Research for OGS,Covered Calls for OGS,Option Chain for OGS,OGS
2786,25,(OHI)  Omega Healthcare Investors Inc. REIT,Stock Research for OHI,Covered Calls for OHI,Option Chain for OHI,OHI
2787,26,(OI)  Owens-Illinois Inc.,Stock Research for OI,Covered Calls for OI,Option Chain for OI,OI
2788,27,(OIH)  VanEck Vectors Oil Services ETF,Stock Research for OIH,Covered Calls for OIH,Option Chain for OIH,OIH
2789,28,(OII)  Oceaneering Intl. Inc.,Stock Research for OII,Covered Calls for OII,Option Chain for OII,OII
2790,29,(OIS)  Oil States Intl. Inc.,Stock Research for OIS,Covered Calls for OIS,Option Chain for OIS,OIS
